省,市,区县,公司简称,公司全名,行业,2017前3季度销售额(万）,利润(万）,利润率,股票代码,注册地址,办公地址,官网,上市日期
辽宁省,鞍山市,铁西区,鞍钢股份,鞍钢股份有限公司,钢铁,6050600,338300,5.60%,鞍钢股份(000898),辽宁省鞍山市铁西区鞍钢厂区,辽宁省鞍山市铁西区鞍钢厂区,www.ansteel.com.cn,1997-12-25
辽宁省,鞍山市,铁东区,梦网荣信,梦网荣信科技集团股份有限公司,互联网,169486,22949,13.50%,梦网集团(002123),辽宁省鞍山市铁东区科技路108号,辽宁省鞍山高新区科技路108号,www.rxpe.com,2007-3-28
辽宁省,鞍山市,铁东区,聚龙股份,聚龙股份有限公司,工业机械,39069,580,1.50%,聚龙股份(300202),辽宁省鞍山市铁东区千山中路308号,辽宁省鞍山市铁东区千山中路308号,www.julong.cc,2011-4-15
辽宁省,鞍山市,铁东区,森远股份,鞍山森远路桥股份有限公司,工业机械,34382,5756,16.70%,森远股份(300210),辽宁省鞍山市鞍千路281号,辽宁省鞍山市鞍千路281号,www.assyrb.com,2011-4-26
辽宁省,鞍山市,千山区,福鞍股份,辽宁福鞍重工股份有限公司,钢铁,21170,2545,12.00%,福鞍股份(603315),辽宁省鞍山市千山区鞍郑路8号,辽宁省鞍山市千山区鞍郑路8号,www.lnfa.com.cn,2015-4-24
辽宁省,鞍山市,立山区,鞍重股份,鞍山重型矿山机器股份有限公司,工业机械,12571,2641,21.00%,鞍重股份(002667),辽宁省鞍山市立山区胜利北路900号,辽宁省鞍山市立山区胜利北路900号,www.aszkjqc.com,2012-3-29
