省,市,区县,公司简称,公司全名,行业,2017前3季度销售额(万）,利润(万）,利润率,股票代码,注册地址,办公地址,官网,上市日期
湖北省,宜昌市,夷陵区,兴发集团,湖北兴发化工集团股份有限公司,通用化工品,1190733,62450,5.20%,兴发集团(600141),湖北省宜昌市兴山县古夫镇高阳大道58号,湖北省宜昌市发展大道97号宜昌三峡企业总部基地D7号楼二层,www.xingfagroup.com,1999-6-16
湖北省,宜昌市,西陵区,启迪桑德,启迪桑德环境资源股份有限公司,综合公共事业,652401,94957,14.60%,启迪桑德(000826),湖北省宜昌市沿江大道114号,湖北省宜昌市绿萝路77号,www.soundenvironmental.cn,1998-2-25
湖北省,宜昌市,西陵区,宜昌交运,湖北宜昌交运集团股份有限公司,公路运输,159745,6763,4.20%,宜昌交运(002627),湖北省宜昌市港窑路5号,湖北省宜昌市港窑路5号,www.ycjyjt.com,2011-11-3
湖北省,宜昌市,伍家岗区,安琪酵母,安琪酵母股份有限公司,食品生产（IV）,418282,67985,16.30%,安琪酵母(600298),湖北省宜昌市城东大道168号（原宜昌市中南路24号）,湖北省宜昌市城东大道168号,www.angelyeast.com,2000-8-18
湖北省,宜昌市,当阳市,三峡新材,湖北三峡新型建材股份有限公司,建材与构件,908141,32052,3.50%,三峡新材(600293),湖北省当阳市经济技术开发区,湖北省当阳市经济技术开发区,www.sxxc.com.cn,2000-9-19
