广东省,深圳市,南山区,中新赛克,深圳市中新赛克科技股份有限公司,软件,30313,10119,33.40%,中新赛克(002912),广东省深圳市南山区粤海街道高新技术产业园区南区高新南一道021号思创科技大厦二楼东面中二号,广东省深圳市南山区粤海街道高新技术产业园区南区高新南一道021号思创科技大厦二楼东,www.sinovatio.com,2017/11/21
广东省,深圳市,南山区,深南电路,深南电路股份有限公司,电子电气组件与设备,421431,33304,7.90%,深南电路(002916),广东省深圳市南山区侨城东路99号,广东省深圳市南山区侨城东路99号,www.scc.com.cn,2017/12/13
广东省,深圳市,南山区,金奥博,深圳市金奥博科技股份有限公司,特种化工品,30135,6240,20.70%,金奥博(002917),广东省深圳市南山区高新技术产业园区（南区）R2-A栋3、4层,广东省深圳市南山区高新技术产业园区（南区）R2-A栋3、4层,www.kingexplorer.com,2017/12/8
广东省,深圳市,南山区,南玻A,中国南玻集团股份有限公司,建材与构件,779091,79955,10.30%,南玻B(200012),广东省深圳市蛇口工业六路一号南玻大厦,广东省深圳市蛇口工业六路一号南玻大厦,www.csgholding.com,1992/2/28
广东省,深圳市,南山区,深康佳A,康佳集团股份有限公司,电子电气组件与设备,2016362,45,0.00%,深康佳B(200016),广东省深圳市南山区粤海街道科技园科技南十二路28号康佳研发大厦15-24层,广东省深圳市南山区科技南十二路28号康佳研发大厦23-24层,www.konka.com,1992/3/27
广东省,深圳市,南山区,深深宝A,深圳市深宝实业股份有限公司,软饮料,23075,-3077,-13.30%,深深宝B(200019),广东省深圳市南山区粤海街道学府路科技园南区软件产业基地4栋B座8层,广东省深圳市南山区学府路科技园南区软件产业基地4栋B座8层,www.sbsy.com.cn,1992/10/12
广东省,深圳市,南山区,深华发A,深圳中恒华发股份有限公司,电子电气组件与设备,67236,-151,-0.20%,深华发B(200020),广东省深圳市福田区华发北路411幢,广东省深圳市南山区大冲商务中心2号楼33层,www.hwafa.com.cn,1992/4/28
广东省,深圳市,南山区,深赤湾A,深圳赤湾港航股份有限公司,运输服务,186291,72556,38.90%,深赤湾B(200022),广东省深圳市赤湾,广东省深圳市赤湾石油大厦8楼,www.szcwh.com,1993/5/5
广东省,深圳市,南山区,飞亚达A,飞亚达(集团)股份有限公司,服装与服饰,247565,17581,7.10%,飞亚达B(200026),广东省深圳市南山区高新南一道飞亚达科技大厦,广东省深圳市南山区高新南一道飞亚达科技大厦20楼,www.fiytagroup.com,1993/6/3
广东省,深圳市,南山区,深南电A,深圳南山热电股份有限公司,电力（IV）,157085,-657,-0.40%,深南电B(200037),广东省深圳市南山区月亮湾大道2097号,广东省深圳市华侨城汉唐大厦16-17楼,www.nsrd.com.cn,1994/7/1
广东省,深圳市,南山区,方大集团,方大集团股份有限公司,建材与构件,205275,42141,20.50%,方大B(200055),广东省深圳市高新区科技南十二路方大大厦,广东省深圳市南山区高新区科技南十二路方大大厦二十楼,www.fangda.com,1996/4/15
广东省,深圳市,南山区,朗科科技,深圳市朗科科技股份有限公司,计算机服务,72515,4241,5.80%,朗科科技(300042),广东省深圳市南山区高新技术产业园区高新南六道朗科大厦16、18、19楼,广东省深圳市南山区高新技术产业园区高新南六道朗科大厦16层,www.netac.com.cn,2010/1/8
广东省,深圳市,南山区,赛为智能,深圳市赛为智能股份有限公司,计算机服务,91690,9842,10.70%,赛为智能(300044),广东省深圳市南山区高新区科技中二路软件园2号楼3楼,广东省深圳市南山区高新区科技中二路软件园2号楼3楼,www.szsunwin.com,2010/1/20
广东省,深圳市,南山区,中青宝,深圳中青宝互动网络股份有限公司,互联网,22980,1552,6.80%,中青宝(300052),广东省深圳市福田区深南大道1006号国际创新中心C栋10楼,广东省深圳市南山区科技园南区W1B栋4楼,www.zqgame.com.cn,2010/2/11
广东省,深圳市,南山区,国民技术,国民技术股份有限公司,电子电气组件与设备,53855,3918,7.30%,国民技术(300077),广东省深圳市南山区高新技术产业园区深圳软件园3栋301、302,广东省深圳市南山区高新南区粤兴三道9号华中科技大学产学研基地A座2-8层,www.nationz.com.cn,2010/4/30
广东省,深圳市,南山区,万讯自控,深圳万讯自控股份有限公司,工业机械,37244,5405,14.50%,万讯自控(300112),广东省深圳市南山区高新技术产业园北区三号路万讯自控大楼1-6层,广东省深圳市南山区高新技术产业园北区三号路万讯自控大楼1-6层,www.maxonic.com.cn,2010/8/27
广东省,深圳市,南山区,信维通信,深圳市信维通信股份有限公司,电子设备,248210,71568,28.80%,信维通信(300136),广东省深圳市宝安区沙井街道西环路1013号A.B栋,广东省深圳市南山区科技园科丰路2号特发信息港大厦A栋北3楼,www.sz-sunway.com.cn,2010/11/5
广东省,深圳市,南山区,雷曼股份,深圳雷曼光电科技股份有限公司,电子电气组件与设备,47285,3113,6.60%,雷曼股份(300162),广东省深圳市南山区松白公路百旺信工业园区二区第八栋,广东省深圳市南山区松白公路百旺信工业园区二区第八栋,www.ledman.cn,2011/1/13
广东省,深圳市,南山区,迪威视讯,深圳市迪威视讯股份有限公司,通讯设备,30157,-132,-0.40%,迪威视讯(300167),广东省深圳市南山区茶光路1089号深圳集成电路设计应用产业园306-1、306-2、307-2室,广东省深圳市南山区西丽镇茶光路南侧深圳集成电路设计应用产业园3楼、4楼,www.dvision.cn,2011/1/25
广东省,深圳市,南山区,翰宇药业,深圳翰宇药业股份有限公司,制药,71446,24813,34.70%,翰宇药业(300199),广东省深圳市南山区高新技术工业园中区翰宇生物医药园办公大楼四层,广东省深圳市南山区高新技术工业园中区翰宇生物医药园四楼,www.hybio.com.cn,2011/4/7
广东省,深圳市,南山区,理邦仪器,深圳市理邦精密仪器股份有限公司,医疗设备,63056,3258,5.20%,理邦仪器(300206),广东省深圳市坪山新区坑梓街道金沙社区金辉路15号,广东省深圳市南山区蛇口南海大道1019号南山医疗器械园B栋三楼,www.edan.com.cn,2011/4/21
广东省,深圳市,南山区,光韵达,深圳光韵达光电科技股份有限公司,电子电气组件与设备,34369,4996,14.50%,光韵达(300227),广东省深圳市南山区高新区北区朗山路13号清华紫光科技园C座1层,广东省深圳市南山区高新区北区朗山路13号清华紫光信息港C座1层,www.sunshine-laser.com,2011/6/8
广东省,深圳市,南山区,方直科技,深圳市方直科技股份有限公司,软件,8004,1114,13.90%,方直科技(300235),广东省深圳市南山区科技中二路深圳软件园12＃楼302,广东省深圳市南山区大新路198号创新大厦B栋9楼,www.kingsunedu.com,2011/6/29
广东省,深圳市,南山区,瑞丰光电,深圳市瑞丰光电子股份有限公司,电子电气组件与设备,121255,5656,4.70%,瑞丰光电(300241),广东省深圳市光明新区公明办事处田寮社区第十工业区1栋六楼,广东省深圳市南山区科技南十二路28号康佳研发大厦5层5C,www.refond.com,2011/7/12
广东省,深圳市,南山区,金信诺,深圳金信诺高新技术股份有限公司,电子电气组件与设备,161782,16787,10.40%,金信诺(300252),广东省深圳市高新区中区深圳软件园9号楼302室,广东省深圳市南山区科技中二路深圳软件园9号楼302室,www.kingsignal.com,2011/8/18
广东省,深圳市,南山区,联建光电,深圳市联建光电股份有限公司,电子设备,281717,39282,13.90%,联建光电(300269),广东省深圳市宝安区68区留仙三路安通达工业厂区四号厂房2楼,广东省深圳市南山区深圳湾科技生态园9栋B1座19楼,www.lcjh.com,2011/10/12
广东省,深圳市,南山区,任子行,任子行网络技术股份有限公司,软件,65039,7327,11.30%,任子行(300311),广东省深圳市南山区高新区科技中2路软件园2栋6楼,广东省深圳市南山区高新区科技中2路软件园2栋6楼,www.1218.com.cn,2012/4/25
广东省,深圳市,南山区,长亮科技,深圳市长亮科技股份有限公司,计算机服务,50847,2917,5.70%,长亮科技(300348),广东省深圳市南山区粤海街道沙河西路深圳湾科技生态园一区2栋A座5层,广东省深圳市南山区沙河西路深圳湾科技生态园一区2栋A座5层,www.sunline.cn,2012/8/17
广东省,深圳市,南山区,赢合科技,深圳市赢合科技股份有限公司,工业机械,118634,15480,13.00%,赢合科技(300457),广东省深圳市龙华区龙华街道和平东路港之龙科技园科技孵化中心5楼E、I区；深圳市龙华区大浪办事处同胜社区,广东省深圳市南山区海德三道天利中央广场B座10楼1001,www.yhwins.com/cn,2015/5/14
广东省,深圳市,南山区,四方精创,深圳四方精创资讯股份有限公司,软件与计算机服务,33082,5374,16.20%,四方精创(300468),广东省深圳市南山区科技中二路深圳科技园12#楼402、深圳软件园（2期）13栋302室,广东省深圳软件园（2期）13栋302室,www.formssi.com,2015/5/27
广东省,深圳市,南山区,蓝海华腾,深圳市蓝海华腾技术股份有限公司,电子电气组件与设备,44299,12664,28.60%,蓝海华腾(300484),广东省深圳市南山区西丽阳光社区新锋大楼B栋第6层,广东省深圳市南山区西丽阳光社区新锋大楼B栋第6层,www.v-t.net.cn,2016/3/22
广东省,深圳市,南山区,名家汇,深圳市名家汇科技股份有限公司,建筑施工,41300,13750,33.30%,名家汇(300506),广东省深圳市南山区南山街道东滨路4351号荔源商务大厦A座13、14、15楼,广东省深圳市南山区南油大道西海岸大厦17 层,www.minkave.com,2016/3/24
广东省,深圳市,南山区,友讯达,深圳友讯达科技股份有限公司,通讯设备,35052,5433,15.50%,友讯达(300514),广东省深圳市南山区桃源街道光前工业区十七栋六楼,广东省深圳市南山区桃源街道光前工业区十七栋六楼,www.friendcom.cn,2017/4/26
广东省,深圳市,南山区,优博讯,深圳市优博讯科技股份有限公司,通讯设备,28064,4171,14.90%,优博讯(300531),广东省深圳市南山区高新区南区粤兴三道8号中国地质大学产学研基地中地大楼A701-710,广东省深圳市南山区高新区南区粤兴三道8号中国地质大学产学研基地中地大楼A701-710,www.urovo.com,2016/8/9
广东省,深圳市,南山区,冰川网络,深圳冰川网络股份有限公司,计算机服务,22493,7297,32.40%,冰川网络(300533),广东省深圳市南山区科技中二路1号深圳软件园（2期）9栋601、602室,广东省深圳市南山区科技中二路1号深圳软件园（2期）9栋601、602室,www.q1.com,2016/8/18
广东省,深圳市,南山区,雄帝科技,深圳市雄帝科技股份有限公司,软件与计算机服务,22642,4338,19.20%,雄帝科技(300546),广东省深圳市南山区粤海街道深圳市软件产业基地1栋C座9层,广东省深圳市南山区粤海街道深圳市软件产业基地1栋C座9层,www.xiongdi.cn,2016/9/28
广东省,深圳市,南山区,安车检测,深圳市安车检测股份有限公司,工业机械,28944,7143,24.70%,安车检测(300572),广东省深圳市南山区科技中2路1号深圳软件园（二期）9栋4楼401室,广东省深圳市南山区科技中2路1号深圳软件园（二期）9栋4楼401室,www.anche.cn,2016/12/6
广东省,深圳市,南山区,康泰生物,深圳康泰生物制品股份有限公司,生物科技,79438,15520,19.50%,康泰生物(300601),广东省深圳市南山区科技工业园科发路6号,广东省深圳市南山区科技工业园科发路6号,www.biokangtai.com,2017/2/7
广东省,深圳市,南山区,飞荣达,深圳市飞荣达科技股份有限公司,电子设备,74017,8093,10.90%,飞荣达(300602),广东省深圳市南山区桃源街道北环路猫头山高发工业区高发8＃厂房一至六层、3#厂房五层西等,广东省深圳市南山区桃源街道北环路猫头山高发工业区高发8＃厂房一至六层、3#厂房五层,www.frd.cn,2017/1/26
广东省,深圳市,南山区,欣天科技,深圳市欣天科技股份有限公司,通讯设备,16596,2198,13.20%,欣天科技(300615),广东省深圳市南山区茶光路波顿科技园B栋万科云创17层05号,广东省深圳市南山区茶光路波顿科技园B栋万科云创17层05号,www.xdc-industries.com,2017/2/15
广东省,深圳市,南山区,开立医疗,深圳开立生物医疗科技股份有限公司,医疗设备,63824,11351,17.80%,开立医疗(300633),广东省深圳市南山区玉泉路毅哲大厦4、5、8、9、10楼,广东省深圳市南山区玉泉路毅哲大厦10楼,www.sonoscape.com,2017/4/6
广东省,深圳市,南山区,广和通,深圳市广和通无线股份有限公司,通讯设备,31515,2741,8.70%,广和通(300638),广东省深圳市南山区南海大道1057号科技大厦二期A栋501A号,广东省深圳市南山区南海大道1057号科技大厦二期A栋501A号,www.fibocom.com.cn,2017/4/13
广东省,深圳市,南山区,民德电子,深圳市民德电子科技股份有限公司,电子电气组件与设备,7988,2820,35.30%,民德电子(300656),广东省深圳市南山区高新区中区科技园工业厂房25栋1段5层（1）号,广东省深圳市南山区高新区中区科技园工业厂房25栋1段5层（1）号,www.mindeo.cn,2017/5/19
广东省,深圳市,南山区,杰恩设计,深圳市杰恩创意设计股份有限公司,建筑施工,18606,5535,29.70%,杰恩设计(300668),广东省深圳市南山区粤海街道科苑路15号科兴科学园B4单元13楼,广东省深圳市南山区粤海街道科苑路15号科兴科学园B4单元13楼,www.jaid.cn,2017/6/19
广东省,深圳市,南山区,澄天伟业,深圳市澄天伟业科技股份有限公司,电子设备,21542,4481,20.80%,澄天伟业(300689),广东省深圳市南山区商业文化中心区天利中央商务广场天利中央商务广场（二期）C-2604,广东省深圳市南山区商业文化中心区天利中央商务广场天利中央商务广场（二期）C-2604,www.ctwygroup.com,2017/8/9
广东省,深圳市,南山区,盛弘股份,深圳市盛弘电气股份有限公司,电子电气组件与设备,33565,4629,13.80%,盛弘股份(300693),广东省深圳市南山区西丽街道松白路1002号百旺信高科技工业园2区6栋,广东省深圳市南山区西丽街道松白路1002号百旺信高科技工业园2区6栋,www.sinexcel.com,2017/8/22
广东省,深圳市,南山区,英可瑞,深圳市英可瑞科技股份有限公司,电子设备,26819,7714,28.80%,英可瑞(300713),广东省深圳市南山区马家龙工业区77栋二、三层,广东省深圳市南山区马家龙工业区77栋二、三层,www.szincrease.com,2017/11/1
广东省,深圳市,南山区,健康元,健康元药业集团股份有限公司,制药,820787,532170,64.80%,健康元(600380),广东省深圳市南山区高新区北区朗山路17号健康元药业集团大厦,广东省深圳市南山区高新区北区朗山路17号健康元药业集团大厦,www.joincare.com,2001/6/8
广东省,深圳市,南山区,金证股份,深圳市金证科技股份有限公司,软件,276745,6065,2.20%,金证股份(600446),广东省深圳市南山区科技园高新区南区高新南五道金证科技大楼8-9层,广东省深圳市南山区科技园高新区南区高新南五道金证科技大楼8-9层,www.szkingdom.com,2003/12/24
广东省,深圳市,南山区,九有股份,深圳九有股份有限公司,电子设备,52981,1335,2.50%,九有股份(600462),广东省深圳市前海深港合作区前湾一路1号A栋201室,广东省深圳市南山区深南大道9672号大冲商务中心3号楼C座2303单元,www.shixianpaper.com,2003/9/3
广东省,深圳市,南山区,长园集团,长园集团股份有限公司,电子电气组件与设备,531445,70366,13.20%,长园集团(600525),广东省深圳市南山区高新区科苑中路长园新材料港高科技1号厂房,广东省深圳市南山区高新区科苑中路长园新材料港F栋5楼,www.cyg.com,2002/12/2
广东省,深圳市,南山区,禾望电气,深圳市禾望电气股份有限公司,电子电气组件与设备,63299,19012,30.00%,禾望电气(603063),广东省深圳市南山区西丽官龙村第二工业区5号厂房1-3层,广东省深圳市南山区西丽官龙村第二工业区5号厂房1-3层,www.hopewind.com,2017/7/28
广东省,深圳市,南山区,共进股份,深圳市共进电子股份有限公司,通讯设备,539838,12069,2.20%,共进股份(603118),广东省深圳市蛇口南海大道1019号南山医疗器械产业园,广东省深圳市蛇口南海大道1019号南山医疗器械产业园,www.twsz.com,2015/2/25
广东省,深圳市,南山区,诺德股份,诺德投资股份有限公司,有色金属,238368,23168,9.70%,诺德股份(600110),吉林省长春市高新技术产业开发区北区航空街1666号,广东省深圳市南山区深南大道9672号华润城大冲商务中心D座21层,www.kinwa.com.cn,1997/10/7
广东省,深圳市,南山区,创维数字,创维数字股份有限公司,通讯设备,514359,6547,1.30%,创维数字(000810),四川省遂宁市经济技术开发区西宁片区台商工业园内,广东省深圳市南山区科技园高新南一道创维大厦A座16楼,www.skyworthdigital.com,1998/6/2
广东省,深圳市,南山区,旗滨集团,株洲旗滨集团股份有限公司,建材与构件,549270,94636,17.20%,旗滨集团(601636),湖南省醴陵市东富镇龙源冲村,广东省深圳市南山区科技园中二路19号劲嘉科技大厦11楼,www.kibinggroup.com,2011/8/12
广东省,深圳市,南山区,保千里,江苏保千里视像科技集团股份有限公司,电子设备,296103,33249,11.20%,保千里(600074),江苏省南京经济技术开发区兴智路兴智科技园B栋21层,广东省深圳市南山区登良路23号汉京国际大厦16层,www.protruly.com.cn,1997/6/23
广东省,深圳市,南山区,民盛金科,民盛金科控股股份有限公司,普通金融服务,62094,868,1.40%,民盛金科(002647),浙江省诸暨市大唐镇开元东路,广东省深圳市南山区粤海街道海德一道88号中洲控股金融中心A座38层E单元,www.mesonft.com,2011/12/28
广东省,深圳市,南山区,深基地B(200053),,{d1},{d2},#VALUE!,深基地B(200053),广东省深圳市蛇口赤湾,广东省深圳市蛇口赤湾石油大厦14楼,,,
广东省,深圳市,南山区,舜喆B(200168),,{d1},{d2},#VALUE!,舜喆B(200168),广东省普宁市军埠镇美新工业园,广东省深圳市南山区东滨路与后海滨路交汇处海王星辰大厦18F,,,
广东省,广州市,南沙区,惠威科技,广州惠威电声科技股份有限公司,电子电气组件与设备,17871,2327,13.00%,惠威科技(002888),广东省广州市南沙区东涌镇三沙公路13号,广东省广州市南沙区东涌镇三沙公路13号,www.hivi.com,2017/7/21
广东省,广州市,南沙区,广州港,广州港股份有限公司,水上运输,594335,85992,14.50%,广州港(601228),广东省广州市南沙区龙穴大道南9号603房,广东省广州市南沙区龙穴大道南9号603房,www.gzport.com,2017/3/29
广东省,广州市,南沙区,天创时尚,广州天创时尚鞋业股份有限公司,鞋类,120487,17573,14.60%,天创时尚(603608),广东省广州市南沙区东涌镇银沙大街31号,广州市南沙区东涌镇银沙大街31号,www.topscore.com.cn,2016/2/18
广东省,佛山市,南海区,雪莱特,广东雪莱特光电科技股份有限公司,耐用消费品,70337,1707,2.40%,雪莱特(002076),广东省佛山市南海区狮山工业科技工业园A区,广东省佛山市南海区桂城街道桂澜北路2号亿能国际广场2座19楼,www.cnlight.com,2006/10/25
广东省,佛山市,南海区,德奥通航,德奥通用航空股份有限公司,耐用消费品,57640,-4481,-7.80%,德奥通航(002260),广东省佛山市南海区松岗松夏工业园工业大道西,广东省佛山市南海区松岗松夏工业园工业大道西,www.elecpro.com,2008/7/16
广东省,佛山市,南海区,星期六,星期六股份有限公司,鞋类,113598,2705,2.40%,星期六(002291),广东省佛山市南海区桂城街道庆安路2号,广东省佛山市南海区桂城街道庆安路2号,www.st-sat.com,2009/9/3
广东省,佛山市,南海区,东方精工,广东东方精工科技股份有限公司,工业机械,233731,19468,8.30%,东方精工(002611),广东省佛山市南海区狮山镇强狮路2号（办公楼、厂房A、厂房B、宿舍A、宿舍B、饭堂）,广东省佛山市南海区狮山镇强狮路2号,www.vmtdf.com,2011/8/30
广东省,佛山市,南海区,德联集团,广东德联集团股份有限公司,通用化工品,194170,11561,6.00%,德联集团(002666),广东省佛山市南海区小塘狮山新城开发区,广东省佛山市南海区狮山镇松岗虹岭二路386号,www.delian.cn,2012/3/27
广东省,佛山市,南海区,南风股份,南方风机股份有限公司,工业机械,50741,-1230,-2.40%,南风股份(300004),广东省佛山市南海区小塘三环西路(狮南段)31号,广东省佛山市南海区小塘三环西路(狮南段)31号,www.ntfan.com,2009/10/30
广东省,佛山市,南海区,南华仪器,佛山市南华仪器股份有限公司,工业机械,13168,2969,22.50%,南华仪器(300417),广东省佛山市南海区桂城街道夏南路59号；广东省佛山市南海区桂城街平胜工业区大马头,广东省佛山市南海区桂城街道夏南路59号,www.nanhua.com.cn,2015/1/23
广东省,佛山市,南海区,雄塑科技,广东雄塑科技集团股份有限公司,管道输送,105922,10804,10.20%,雄塑科技(300599),广东省佛山市南海区九江镇龙高路敦根路段雄塑工业园,广东省佛山市南海区九江镇龙高路敦根路段雄塑工业园,www.xiongsu.cn,2017/1/23
广东省,佛山市,南海区,新劲刚,广东新劲刚新材料科技股份有限公司,建材与构件,16756,1401,8.40%,新劲刚(300629),广东省佛山市南海区丹灶镇五金工业区博金路6号办公楼及车间,广东省佛山市南海区丹灶镇五金工业区博金路6号,www.king-strong.com,2017/3/24
广东省,佛山市,南海区,瀚蓝环境,瀚蓝环境股份有限公司,水务,306042,64721,21.10%,瀚蓝环境(600323),广东省佛山市南海区桂城南海大道财联大厦,广东省佛山市南海区桂城南海大道建行大厦,www.grandblue.cn,2000/12/25
广东省,佛山市,南海区,N蒙娜(002918),,206201,28707,13.90%,N蒙娜(002918),广东省佛山市南海区西樵轻纺城工业园,广东省佛山市南海区西樵轻纺城工业园,,,
广东省,梅州市,梅县,宝新能源,广东宝丽华新能源股份有限公司,电力（IV）,180856,32890,18.20%,宝新能源(000690),广东省梅州市梅县华侨城香港花园宝丽华综合大楼,广东省梅州市梅县华侨城香港花园宝丽华综合大楼,www.baolihua.com.cn,1997/1/28
广东省,梅州市,梅县,嘉应制药,广东嘉应制药股份有限公司,制药,29343,1476,5.00%,嘉应制药(002198),广东省梅州市东升工业园B区,广东省梅州市东升工业园B区,www.gdjyzy.com.cn,2007/12/18
广东省,梅州市,梅县,超华科技,广东超华科技股份有限公司,电子电气组件与设备,99434,3692,3.70%,超华科技(002288),广东省梅州市梅县区宪梓南路19号,广东省梅县雁洋镇超华工业园,www.chaohuatech.com,2009/9/3
广东省,梅州市,梅县,梅雁吉祥,广东梅雁吉祥水电股份有限公司,电力（IV）,18955,11703,61.70%,梅雁吉祥(600868),广东省梅州市梅县新县城沿江南路1号,广东省梅州市梅县新县城沿江南路1号,www.chinameiyan.com,1994/9/12
广东省,茂名市,茂南区,茂化实华,茂名石化实华股份有限公司,通用化工品,330811,11127,3.40%,茂化实华(000637),广东省茂名市官渡路162号,广东省茂名市官渡路162号,www.mhsh0637.com.cn,1996/11/14
广东省,湛江市,麻章区,国联水产,湛江国联水产开发股份有限公司,农业与渔业,301445,11981,4.00%,国联水产(300094),广东省湛江开发区平乐工业区永平南路,广东省湛江经济技术开发区永平南路6号,www.gl-fish.com,2010/7/8
广东省,湛江市,麻章区,冠豪高新,广东冠豪高新技术股份有限公司,造纸,139494,4126,3.00%,冠豪高新(600433),广东省湛江市东海岛东海大道313号,广东省湛江市东海岛东海大道313号,www.guanhao.com,2003/6/19
广东省,广州市,萝岗区,达志科技,广东达志环保科技股份有限公司,通用化工品,10524,4451,42.30%,达志科技(300530),广东省广州经济技术开发区永和经济区田园东路1号、2号,广东省广州经济技术开发区永和经济区田园东路1号、2号,www.dazhitech.com,2016/8/9
广东省,广州市,萝岗区,穗恒运A,广州恒运企业集团股份有限公司,电力（IV）,222358,21088,9.50%,穗恒运A(000531),广东省广州市萝岗区西基工业区西基路,广东省广州开发区开发大道235号恒运大厦6-6M层,www.hengyun.com.cn,1994/1/6
广东省,广州市,萝岗区,广电运通,广州广电运通金融电子股份有限公司,工业机械,243295,84555,34.80%,广电运通(002152),广东省广州市萝岗区科学城科林路9号,广东省广州市萝岗区科学城科林路9号,www.grgbanking.com,2007/8/13
广东省,广州市,萝岗区,御银股份,广州御银科技股份有限公司,工业机械,39071,-936,-2.40%,御银股份(002177),广东省广州市天河区高唐路234号901房,广东省广州市萝岗区瑞发路12号,www.kingteller.com.cn,2007/11/1
