广东省,揭阳市,揭东区,广东榕泰,广东榕泰实业股份有限公司,特种化工品,103905,10961,10.50%,广东榕泰(600589),广东省揭阳市区新兴东二路1号,广东省揭阳市揭东区经济试验区西侧,www.gdrongtai.cn,2001/6/12
广东省,梅州市,蕉岭县,塔牌集团,广东塔牌集团股份有限公司,建材与构件,304192,67728,22.30%,塔牌集团(002233),广东省梅州市蕉岭县蕉城镇（塔牌大厦）,广东省梅州市蕉岭县蕉城镇（塔牌大厦）,www.tapai.com,2008/5/16
广东省,江门市,江海区,科恒股份,江门市科恒实业股份有限公司,电子电气组件与设备,131983,14608,11.10%,科恒股份(300340),广东省江门市江海区?蛲??蛐四下?22号,广东省江门市江海区?蛲??蛐四下?22号,www.keheng.com.cn,2012/7/26
广东省,江门市,江海区,地尔汉宇,江门市地尔汉宇电器股份有限公司,电子电气组件与设备,57249,15440,27.00%,地尔汉宇(300403),广东省江门市高新技术开发区清澜路336号,广东省江门市高新技术开发区清澜路336号,www.idearhanyu.com,2014/10/30
广东省,惠州市,惠阳区,胜宏科技,胜宏科技(惠州)股份有限公司,电子电气组件与设备,173163,22029,12.70%,胜宏科技(300476),广东省惠州市惠阳区淡水镇新桥村行诚科技园,广东省惠州市惠阳区淡水镇新桥村行诚科技园,www.shpcb.com,2015/6/11
广东省,惠州市,惠阳区,中潜股份,中潜股份有限公司,工业机械,28105,3333,11.90%,中潜股份(300526),广东省惠州市惠阳区新圩镇长布村,广东省惠州市惠阳区新圩镇长布村,www.sumnet.com.cn,2016/8/2
广东省,惠州市,惠城区,TCL集团,TCL集团股份有限公司,消费电子产品,8221473,376145,4.60%,TCL集团(000100),广东省惠州市仲恺高新技术开发区十九号小区,广东省惠州市仲恺高新区惠风三路17号TCL科技大厦,www.tcl.com,2004/1/30
广东省,惠州市,惠城区,中京电子,惠州中京电子科技股份有限公司,电子电气组件与设备,77212,1132,1.50%,中京电子(002579),广东省惠州市仲恺高新区陈江街道中京路1号,广东省惠州市仲恺高新区陈江街道中京路1号,www.ceepcb.com,2011/5/6
广东省,惠州市,惠城区,华阳集团,惠州市华阳集团股份有限公司,电子电气组件与设备,308911,21410,6.90%,华阳集团(002906),广东省惠州市东江高新科技产业园上霞北路1号华阳工业园A区集团办公大楼,广东省惠州市东江高新科技产业园上霞北路1号华阳工业园A区集团办公大楼,www.foryougroup.com,2017/10/13
广东省,惠州市,惠城区,亿纬锂能,惠州亿纬锂能股份有限公司,电子电气组件与设备,198696,41518,20.90%,亿纬锂能(300014),广东省惠州市仲恺高新区惠风七路36号,广东省惠州市仲恺高新区惠风七路36号,www.evebattery.com,2009/10/30
广东省,惠州市,惠城区,硕贝德,惠州硕贝德无线科技股份有限公司,通讯设备,147150,895,0.60%,硕贝德(300322),广东省惠州市东江高新区上霞片区SX-01-02号,广东省惠州市东江高新区上霞片区SX-01-02号,www.speed-hz.com,2012/6/8
广东省,惠州市,惠城区,广东骏亚,广东骏亚电子科技股份有限公司,电子设备,70436,5145,7.30%,广东骏亚(603386),广东省惠州市惠城区（三栋）数码工业园25号区,广东省惠州市惠城区（三栋）数码工业园25号区,www.championasia.hk,2017/9/12
广东省,广州市,黄埔区,弘亚数控,广州弘亚数控机械股份有限公司,工业机械,62615,21301,34.00%,弘亚数控(002833),广东省广州市黄埔区云埔工业区云开路3号,广东省广州市黄埔区云埔工业区云开路3号及广东省广州市黄埔区云骏路17号自编一栋、自编第二栋、自编3栋,www.kdtmac.com,2016/12/28
广东省,广州市,黄埔区,智光电气,广州智光电气股份有限公司,电子电气组件与设备,102087,10672,10.50%,智光电气(002169),广东省广州市黄埔区云埔工业区埔南路51号,广东省广州市黄埔区瑞和路89号,www.gzzg.com.cn,2007/9/19
广东省,广州市,黄埔区,毅昌股份,广州毅昌科技股份有限公司,汽车零配件（IV）,372817,-24457,-6.60%,毅昌股份(002420),广东省广州市高新技术产业开发区科学城科丰路29号,广东省广州市高新技术产业集团有限公司科丰路29号,www.echom.com,2010/6/1
广东省,广州市,黄埔区,海格通信,广州海格通信集团股份有限公司,通讯设备,225702,21613,9.60%,海格通信(002465),广东省广州市高新技术产业开发区科学城海云路88号,广东省广州市高新技术产业开发区科学城海云路88号,www.haige.com,2010/8/31
广东省,广州市,黄埔区,摩登大道,摩登大道时尚集团股份有限公司,服装服饰零售,65509,11121,17.00%,摩登大道(002656),广东省广州市天河区黄埔大道西638号富力科讯大厦1310房,广东省广州市黄埔区科学城光谱中路23号,www.canudilo.com,2012/2/28
广东省,广州市,黄埔区,天赐材料,广州天赐高新材料股份有限公司,通用化工品,153353,32092,20.90%,天赐材料(002709),广东省广州市黄埔区云埔工业区东诚片康达路8号,广东省广州市黄埔区云埔工业区东诚片康达路8号,www.tinci.com,2014/1/23
广东省,广州市,黄埔区,视源股份,广州视源电子科技股份有限公司,电子电气组件与设备,746286,66822,9.00%,视源股份(002841),广东省广州市黄埔区云埔四路6号,广东省广州市黄埔区云埔四路6号,www.cvte.com,2017/1/19
广东省,广州市,黄埔区,集泰股份,广州集泰化工股份有限公司,特种化工品,54528,4278,7.80%,集泰股份(002909),广东省广州市高新技术产业开发区南翔一路62号自编六栋二楼、五楼,广东省广州市高新技术产业开发区南翔一路62号自编六栋二楼、五楼,www.jointas.com,2017/10/26
广东省,广州市,黄埔区,冠昊生物,广东冠昊生物科技股份有限公司,医疗设备,31424,5208,16.60%,冠昊生物(300238),广东省广州市黄埔区玉岩路12号,广东省广州市黄埔区玉岩路12号,www.grandhopebio.com,2011/7/6
广东省,广州市,黄埔区,高澜股份,广州高澜节能技术股份有限公司,电子电气组件与设备,41203,2062,5.00%,高澜股份(300499),广东省广州市高新技术产业开发区科学城南云五路3号,广东省广州市高新技术产业开发区科学城南云五路3号,www.goaland.com.cn,2016/2/2
广东省,广州市,黄埔区,金发科技,金发科技股份有限公司,特种化工品,1658623,55231,3.30%,金发科技(600143),广东省广州市高新技术产业开发区科学城科丰路33号,广东省广州市高新技术产业开发区科学城科丰路33号,www.kingfa.com.cn,2004/6/23
广东省,广州市,环市,珠江实业,广州珠江实业开发股份有限公司,不动产投资开发,312874,61625,19.70%,珠江实业(600684),广东省广州市环市东路362-366号好世界广场30楼,广东省广州市环市东路362-366号好世界广场30楼,www.gzzjsy.com,1993/10/28
广东省,肇庆市,怀集县,登云股份,怀集登云汽配股份有限公司,汽车,25159,929,3.70%,登云股份(002715),广东省怀集县怀城镇登云亭,广东省怀集县怀城镇登云亭,www.huaijivalve.com,2014/2/19
广东省,广州市,花都区,国光电器,国光电器股份有限公司,电子电气组件与设备,253507,11056,4.40%,国光电器(002045),广东省广州市花都区新雅街镜湖大道8号,广东省广州市花都区新华街镜湖大道8号,www.ggec.com.cn,2005/5/23
广东省,广州市,花都区,鸿利智汇,鸿利智汇集团股份有限公司,电子电气组件与设备,257978,23142,9.00%,鸿利智汇(300219),广东省广州市花都区花东镇先科一路1号,广东省广州市花都区机场高新科技产业基地金谷南路与先科一路交汇,www.honglitronic.com,2011/5/18
广东省,江门市,鹤山市,世运电路,广东世运电路科技股份有限公司,电子设备,147690,17957,12.20%,世运电路(603920),广东省鹤山市共和镇世运路8号,广东省鹤山市共和镇世运路8号,www.olympicpcb.com,2017/4/26
广东省,江门市,鹤山市,广弘控股,广东广弘控股股份有限公司,食品生产（IV）,147109,13006,8.80%,广弘控股(000529),广东省广州市天河区广州大道北520号,广东省鹤山市人民西路40号,www.ghkg000529.com,1993/11/18
广东省,汕头市,濠江区,英联股份,广东英联包装股份有限公司,耐用消费品,30412,4028,13.20%,英联股份(002846),广东省汕头市濠江区达南路中段,广东省汕头市濠江区达南路中段,www.enpackcorp.com,2017/2/7
广东省,汕头市,濠江区,万顺股份,汕头万顺包装材料股份有限公司,有色金属,223286,8541,3.80%,万顺股份(300057),广东省汕头保税区万顺工业园,广东省汕头保税区万顺工业园,www.wanshun.cn,2010/2/26
广东省,汕头市,濠江区,金明精机,广东金明精机股份有限公司,工业机械,28597,3904,13.70%,金明精机(300281),广东省汕头市濠江区纺织工业园,广东省汕头市濠江区纺织工业园,www.jmjj.com,2011/12/29
广东省,广州市,海珠区,东凌国际,广州东凌国际投资股份有限公司,食品生产（IV）,110735,-3775,-3.40%,东凌国际(000893),广东省广州市南沙区万顷沙镇红安路3号,广东省广州市海珠区新港东路1166号环汇商业广场南塔19层,www.dongling.cn,1998/12/24
广东省,广州市,海珠区,省广股份,广东省广告股份有限公司,媒介代理,701496,24116,3.40%,省广股份(002400),广东省广州市越秀区东风东路745号之二,广东省广州市海珠区新港东路996号保利世界贸易中心G座,www.gdadc.com,2010/5/6
广东省,广州市,海珠区,珠江啤酒,广州珠江啤酒股份有限公司,酿酒业,309339,18785,6.10%,珠江啤酒(002461),广东省广州市海珠区新港东路磨碟沙大街118号,广东省广州市海珠区新港东路磨碟沙大街118号,www.zhujiangbeer.com,2010/8/18
广东省,广州市,海珠区,杰赛科技,广州杰赛科技股份有限公司,通讯设备,214818,3156,1.50%,杰赛科技(002544),广东省广州市新港中路381号,广东省广州市新港中路381号杰赛科技大楼,www.chinagci.com,2011/1/28
广东省,广州市,海珠区,万里马,广东万里马实业股份有限公司,鞋类,40172,3062,7.60%,万里马(300591),东莞市长安镇建安路367号,广州市海珠区新港东路1028号保利世界贸易中心F座2、3层,www.wanlima.com.cn,2017/1/10
广东省,广州市,海珠区,保利地产,保利房地产(集团)股份有限公司,不动产投资开发,7554048,1395846,18.50%,保利地产(600048),广东省广州市海珠区阅江中路688号保利国际广场北塔30-33层,广东省广州市海珠区阅江中路688号保利国际广场北塔30-33层,www.polycn.com;www.gzpoly.com,2006/7/31
广东省,广州市,海珠区,金域医学,广州金域医学检验集团股份有限公司,医疗保健服务,279998,19151,6.80%,金域医学(603882),广东省广州市国际生物岛螺旋三路10号,广东省广州市国际生物岛螺旋三路10号,www.kingmed.com.cn,2017/9/8
广东省,深圳市,光明新区,海洋王,海洋王照明科技股份有限公司,耐用消费品,66061,7021,10.60%,海洋王(002724),广东省深圳市光明新区光明街道高新路1601号海洋王科技楼B栋1层,广东省深圳市光明新区高新路1601号海洋王科技楼,www.haiyangwang.com,2014/11/4
广东省,肇庆市,高要市,天龙集团,广东天龙油墨集团股份有限公司,商业辅助服务,480006,13594,2.80%,天龙集团(300063),广东省肇庆市金渡工业园内,广东省肇庆市金渡工业园内,www.tlym.cn,2010/3/26
广东省,肇庆市,高要区,广东鸿图,广东鸿图科技股份有限公司,工业机械,351621,29871,8.50%,广东鸿图(002101),广东省肇庆市高要区金渡世纪大道168号,广东省肇庆市高要区金渡世纪大道168号,www.ght-china.com,2006/12/29
广东省,肇庆市,高要区,华锋股份,肇庆华锋电子铝箔股份有限公司,电子电气组件与设备,31135,1568,5.00%,华锋股份(002806),广东省肇庆市端州区端州工业城,广东省肇庆市高要区金渡镇工业园二期B17地块,www.c-hfcc.com,2016/7/26
广东省,珠海市,高新区,东信和平,东信和平智能卡股份有限公司,电子设备,84589,2877,3.40%,东信和平(002017),广东省珠海市高新区南屏科技工业园屏工中路8号,广东省珠海市高新区南屏科技工业园屏工中路8号,www.eastcompeace.com,2004/7/13
广东省,珠海市,高新区,宝莱特,广东宝莱特医用科技股份有限公司,医疗设备,51757,7351,14.20%,宝莱特(300246),广东省珠海市高新区科技创新海岸创新一路2号,广东省珠海市高新区科技创新海岸创新一路2号,www.blt.com.cn,2011/7/19
广东省,珠海市,高新区,全志科技,珠海全志科技股份有限公司,电子电气组件与设备,76352,340,0.40%,全志科技(300458),广东省珠海市高新区唐家湾镇科技二路9号,广东省珠海市高新区唐家湾镇科技二路9号,www.allwinnertech.com,2015/5/15
广东省,珠海市,高新区,健帆生物,珠海健帆生物科技股份有限公司,医疗设备,49179,23179,47.10%,健帆生物(300529),广东省珠海市高新区科技六路98号,广东省珠海市高新区科技六路98号,www.jafron.com,2016/8/2
广东省,珠海市,高新区,英搏尔,珠海英搏尔电气股份有限公司,电子电气组件与设备,33487,6092,18.20%,英搏尔(300681),广东省珠海市高新区唐家湾镇科技六路7号,广东省珠海市高新区科技六路7号,www.in-powercar.com,2017/7/25
广东省,深圳市,高新区,天源迪科,深圳天源迪科信息技术股份有限公司,软件,160121,4560,2.80%,天源迪科(300047),广东省深圳市南山区粤海街道高新区南区市高新技术工业村T3栋B3楼,广东省深圳市高新区南区市高新技术工业村T3栋B3楼,www.tydic.com,2010/1/20
广东省,江门市,高新区,量子高科,江门量子高科生物股份有限公司,食品生产（IV）,19466,5783,29.70%,量子高科(300149),广东省江门市高新区高新西路133号,广东省江门市高新区高新西路133号,www.qht.cc,2010/12/22
广东省,深圳市,福田区,三元达,福建三元达通讯股份有限公司,通讯设备,9963,-4676,-46.90%,三元达(002417),江苏省南通市港闸区江海佳苑19幢18层,广东省深圳市福田区益田路1006号益田创新科技园19栋7楼、江苏省南通市港闸区江海大道817号江海财富大厦A1801,www.sunnada.com,2010/6/1
广东省,深圳市,福田区,全新好,深圳市全新好股份有限公司,不动产投资开发,3406,-542,-15.90%,全新好(000007),广东省深圳市福田区梅林街道梅康路8号理想时代大厦6楼,广东省深圳市福田区梅林街道梅康路8号理想时代大厦6楼,--,1992/4/13
广东省,深圳市,福田区,美丽生态,深圳美丽生态股份有限公司,建筑施工,64000,2877,4.50%,美丽生态(000010),广东省深圳市宝安区西乡街道宝安桃花源科技创新园主园A栋孵化大楼321-322室,广东省深圳市福田区中心四路1-1号嘉里建设广场第三座3201室,--,1995/10/27
广东省,深圳市,福田区,深科技,深圳长城开发科技股份有限公司,计算机硬件,1072555,59058,5.50%,深科技(000021),广东省深圳市福田区彩田路7006号,广东省深圳市福田区彩田路7006号,www.kaifa.com.cn,1994/2/2
广东省,深圳市,福田区,深圳能源,深圳能源集团股份有限公司,电力（IV）,1044575,115163,11.00%,深圳能源(000027),广东省深圳市福田区深南中路2068号华能大厦5，33，35-36，38-41层,广东省深圳市福田区深南中路2068号华能大厦5，33，35-36，38-41层,www.sec.com.cn,1993/9/3
广东省,深圳市,福田区,国药一致,国药集团一致药业股份有限公司,药品零售,3127872,109402,3.50%,国药一致(000028),广东省深圳市福田区八卦四路15号一致药业大楼,广东省深圳市福田区八卦四路15号一致药业大楼,www.szaccord.com.cn,1993/8/9
广东省,深圳市,福田区,中粮地产,中粮地产（集团）股份有限公司,不动产投资开发,849918,160560,18.90%,中粮地产(000031),广东省深圳市宝安区新安街道3区龙井二路3号中粮地产集团中心第1层101室,广东省深圳市福田区福华一路1号大中华国际交易广场35层,www.cofco-property.cn,1993/10/8
广东省,深圳市,福田区,中航地产,中航地产股份有限公司,不动产投资开发,374427,3647,1.00%,中航地产(000043),广东省深圳市福田区振华路163号飞亚达大厦六楼,广东省深圳市福田区振华路163号飞亚达大厦六楼,www.carec.com.cn,1994/9/28
广东省,深圳市,福田区,深纺织A,深圳市纺织(集团)股份有限公司,服装与服饰,107034,5113,4.80%,深纺织A(000045),广东省深圳市福田区华强北路3号深纺大厦6楼,广东省深圳市福田区华强北路3号深纺大厦6楼,www.chinasthc.com,1994/8/15
广东省,深圳市,福田区,康达尔,深圳市康达尔(集团)股份有限公司,农业与渔业,112876,-4862,-4.30%,康达尔(000048),广东省深圳市罗湖区深南东路1086号集浩大厦二、三楼,广东省深圳市福田区深南大道和泰然大道交汇处绿景纪元大厦24楼,www.kondarl.com,1994/11/1
广东省,深圳市,福田区,皇庭国际,深圳市皇庭国际企业股份有限公司,不动产投资开发,56010,18198,32.50%,皇庭国际(000056),广东省深圳市福田区金田路2028号皇岗商务中心58楼03单元,广东省深圳市福田区金田路2028号皇岗商务中心58楼,www.china-ia.com,1996/7/8
广东省,深圳市,福田区,深赛格,深圳赛格股份有限公司,电子电气组件与设备,85712,13050,15.20%,深赛格(000058),广东省深圳市福田区华强北路群星广场A座三十一楼,广东省深圳市福田区华强北路群星广场A座三十一楼,www.segcl.com.cn,1996/12/26
广东省,深圳市,福田区,中金岭南,深圳市中金岭南有色金属股份有限公司,有色金属,1479158,112867,7.60%,中金岭南(000060),广东省深圳市福田区车公庙深南大道6013号中国有色大厦24-26楼,广东省深圳市福田区车公庙深南大道6013号中国有色大厦24楼,www.nonfemet.com,1997/1/23
广东省,深圳市,福田区,农产品,深圳市农产品股份有限公司,食品零售与批发,170286,9335,5.50%,农产品(000061),广东省深圳市罗湖区布吉路1019号农产品批发市场第一层,广东省深圳市福田区深南大道7028号时代科技大厦13楼,www.szap.com,1997/1/10
广东省,深圳市,福田区,深圳华强,深圳华强实业股份有限公司,消费电子产品,549438,47588,8.70%,深圳华强(000062),广东省深圳市福田区华强北路华强广场A座5楼,广东省深圳市福田区华强北路华强广场A座5楼,www.szhq000062.com,1997/1/30
广东省,深圳市,福田区,天健集团,深圳市天健(集团)股份有限公司,建筑施工,454475,72965,16.10%,天健集团(000090),广东省深圳市福田区滨河大道5020号证券大厦21楼,广东省深圳市福田区滨河大道5020号证券大厦21楼,www.tagen.cn,1999/7/21
广东省,深圳市,福田区,麦达数字,深圳市麦达数字股份有限公司,互联网,62670,8166,13.00%,麦达数字(002137),广东省深圳市龙岗区宝龙工业城宝龙六路实益达科技园,广东省深圳市福田区彩田路新浩e都A座2801,www.sz-seastar.com,2007/6/13
广东省,深圳市,福田区,贤丰控股,贤丰控股股份有限公司,电子电气组件与设备,84169,140,0.20%,贤丰控股(002141),广东省珠海市金湾区三灶镇三灶科技工业园,广东省深圳市福田区益田路6001号太平金融大厦32楼,www.ronsen.com.cn,2007/7/20
广东省,深圳市,福田区,飞马国际,深圳市飞马国际供应链股份有限公司,运输服务,4965321,22643,0.50%,飞马国际(002210),广东省深圳市福田区深南大道7008号阳光高尔夫大厦26楼2601室,广东省深圳市福田区深南大道7008号阳光高尔夫大厦2601室,www.fmscm.com,2008/1/30
广东省,深圳市,福田区,天威视讯,深圳市天威视讯股份有限公司,广播与娱乐,116690,18447,15.80%,天威视讯(002238),广东省深圳市福田区彩田路6001号,广东省深圳市福田区彩田路6001号,www.topway.com.cn,2008/5/26
广东省,深圳市,福田区,威华股份,广东威华股份有限公司,建材与构件,147495,1652,1.10%,威华股份(002240),广东省深圳市福田区华富街道华富路1018号中航中心31楼3101-3102,广东省深圳市福田区华富街道华富路1018号中航中心31楼3101-3102,www.weihuaonline.com,2008/5/23
广东省,深圳市,福田区,信立泰,深圳信立泰药业股份有限公司,制药,310207,127419,41.10%,信立泰(002294),广东省深圳市福田区深南大道6009号车公庙绿景广场主楼37层,广东省深圳市福田区深南大道6009号车公庙绿景广场主楼37层,www.salubris.cn,2009/9/10
广东省,深圳市,福田区,赫美集团,深圳赫美集团股份有限公司,服装服饰零售,188804,19342,10.20%,赫美集团(002356),广东省深圳市坪山新区金牛西路16号华瀚科技工业2号厂房218A,广东省深圳市福田区深南大道6011号NEO大厦A栋34楼,www.hemei.cn,2010/2/9
广东省,深圳市,福田区,新亚制程,深圳市新亚电子制程股份有限公司,电子设备,61533,3660,5.90%,新亚制程(002388),广东省深圳市福田区中康路卓越梅林中心广场（北区）1栋306A,广东省深圳市福田区中康路卓越梅林中心广场（北区）1栋306A,www.sunyes.cn,2010/4/13
广东省,深圳市,福田区,捷顺科技,深圳市捷顺科技实业股份有限公司,计算机服务,52678,14148,26.90%,捷顺科技(002609),深圳市福田区梅林街道龙尾路10号捷顺科技,深圳市福田区龙尾路10号捷顺科技,www.jieshun.cn,2011/8/15
广东省,深圳市,福田区,万润科技,深圳万润科技股份有限公司,电子电气组件与设备,206187,14859,7.20%,万润科技(002654),广东省深圳市光明新区观光路3009号招商局光明科技园A3栋05B3室,广东省深圳市福田区福华路北深圳国际交易广场1812-1816号,www.mason-led.com,2012/2/17
广东省,深圳市,福田区,国盛金控,国盛金融控股集团股份有限公司,投资服务,63503,47801,75.30%,国盛金控(002670),广东省佛山市顺德区容桂华口昌宝东路13号,广东省深圳市福田区益田路5033号平安金融中心101层,www.wasung.com,2012/4/16
广东省,深圳市,福田区,易尚展示,深圳市易尚展示股份有限公司,家具,48278,2036,4.20%,易尚展示(002751),广东省深圳市福田区福强路4001号（深圳文化创意园）AB座三层B301,广东省深圳市福田区福强路4001号深圳文化创意园AB座三层B301,www.es-display.com,2015/4/24
广东省,深圳市,福田区,汇洁股份,深圳汇洁集团股份有限公司,服装与服饰,153871,31898,20.70%,汇洁股份(002763),广东省深圳市福田区深南大道1006号深圳国际创新中心A栋31-33层,广东省深圳市福田区深南大道1006号深圳国际创新中心A栋31-33层,www.huijiegroup.com,2015/6/10
广东省,深圳市,福田区,普路通,深圳市普路通供应链管理股份有限公司,综合供应商,399401,17418,4.40%,普路通(002769),广东省深圳市福田区深南大道1006号深圳国际创新中心A栋21楼,广东省深圳市福田区深南大道1006号深圳国际创新中心A栋21楼,www.prolto.com,2015/6/29
广东省,深圳市,福田区,文科园林,深圳文科园林股份有限公司,林业,193040,20635,10.70%,文科园林(002775),广东省深圳市福田区深南大道1006号深圳国际创新中心（福田科技广场）A栋35、36层,广东省深圳市福田区滨河路以南沙嘴路以东中央西谷大厦21层,www.wkyy.com,2015/6/29
广东省,深圳市,福田区,奇信股份,深圳市奇信建设集团股份有限公司,建筑施工,264488,15692,5.90%,奇信股份(002781),广东省深圳市福田区江南名苑一、二层,广东省深圳市福田区江南名苑一、二层,www.qxzs.com,2015/12/22
广东省,深圳市,福田区,建艺集团,深圳市建艺装饰集团股份有限公司,建筑施工,196289,8533,4.30%,建艺集团(002789),广东省深圳市福田区振兴路建艺大厦19层东,广东省深圳市福田区振兴路建艺大厦19层东,www.jyzs.com.cn,2016/3/11
广东省,深圳市,福田区,第一创业,第一创业证券股份有限公司,投资服务,136580,37802,27.70%,第一创业(002797),广东省深圳市福田区福华一路115号投行大厦20楼,广东省深圳市福田区福华一路115号投行大厦20楼,www.firstcapital.com.cn,2016/5/11
广东省,深圳市,福田区,亚泰国际,深圳市亚泰国际建设股份有限公司,建筑施工,132571,7875,5.90%,亚泰国际(002811),广东省深圳市福田区中心区益田路与福华路交汇处卓越时代广场4B01、4B02,广东省深圳市福田区中心区益田路与福华路交汇处卓越时代广场4B01、4B02,www.atgcn.com,2016/9/8
广东省,深圳市,福田区,美芝股份,深圳市美芝装饰设计工程股份有限公司,建筑施工,61771,4541,7.40%,美芝股份(002856),广东省深圳市福田区八卦四路科研楼7栋1-6层,广东省深圳市福田区八卦四路科研楼7栋1-6层,www.szmeizhi.com,2017/3/20
广东省,深圳市,福田区,东方嘉盛,深圳市东方嘉盛供应链股份有限公司,百货零售,633360,11312,1.80%,东方嘉盛(002889),广东省深圳市前海深港合作区前湾一路1号A栋201室,广东省深圳市福田保税区市花路10号东方嘉盛大厦6楼,www.easttop.com.cn,2017/7/31
广东省,深圳市,福田区,国药一致,国药集团一致药业股份有限公司,药品零售,3127872,109402,3.50%,一致B(200028),广东省深圳市福田区八卦四路15号一致药业大楼,广东省深圳市福田区八卦四路15号一致药业大楼,www.szaccord.com.cn,1993/8/9
