广东省,广州市,萝岗区,达意隆,广州达意隆包装机械股份有限公司,工业机械,68747,-1668,-2.40%,达意隆(002209),广州市黄埔区云埔一路23号,广东省广州市萝岗区云埔一路23号,www.tech-long.com,2008/1/30
广东省,广州市,萝岗区,威创股份,威创集团股份有限公司,电子电气组件与设备,79964,18905,23.60%,威创股份(002308),广东省广州高新技术产业开发区科珠路233号,广东省广州高新技术产业开发区科珠路233号,www.vtron.com,2009/11/27
广东省,广州市,萝岗区,阳普医疗,广州阳普医疗科技股份有限公司?,医疗设备,37593,1346,3.60%,阳普医疗(300030),广东省广州市经济技术开发区科学城开源大道102号,广东省广州市经济技术开发区科学城开源大道102号,www.improve-medical.com,2009/12/25
广东省,广州市,萝岗区,高新兴,高新兴科技集团股份有限公司,软件与计算机服务,135731,30527,22.50%,高新兴(300098),广东省广州市萝岗区科学城开创大道2819号六楼,广东省广州市萝岗区科学城开创大道2819号,www.gosuncn.com,2010/7/28
广东省,广州市,萝岗区,汤臣倍健,汤臣倍健股份有限公司,食品生产（IV）,235023,97337,41.40%,汤臣倍健(300146),广东省珠海市金湾区三灶科技工业园星汉路19号,广东省广州市萝岗区科学城科学大道中99号科汇金谷科汇三街3号,www.by-health.com.cn,2010/12/15
广东省,广州市,萝岗区,香雪制药,广州市香雪制药股份有限公司,制药,163163,7728,4.70%,香雪制药(300147),广东省广州市萝岗区广州经济技术开发区科学城金峰园路2号,广东省广州市萝岗区广州经济技术开发区科学城金峰园路2号,www.xphcn.com,2010/12/15
广东省,广州市,萝岗区,安居宝,广东安居宝数码科技股份有限公司,电子设备,54922,775,1.40%,安居宝(300155),广东省广州高新技术产业开发区科学城起云路6号自编一栋,广东省广州高新技术产业开发区科学城起云路6号自编二栋,www.anjubao.com,2011/1/7
广东省,广州市,萝岗区,迪森股份,广州迪森热能技术股份有限公司,综合公共事业,127162,23412,18.40%,迪森股份(300335),广东省广州市经济开发区东区东众路42号,广东省广州市经济开发区东区东众路42号,www.devotiongroup.com,2012/7/10
广东省,广州市,萝岗区,航新科技,广州航新航空科技股份有限公司,航空航天,30413,3283,10.80%,航新科技(300424),广东省广州市经济技术开发区科学城光宝路1号,广东省广州市经济技术开发区科学城光宝路1号,www.hangxin.com,2015/4/22
广东省,广州市,萝岗区,万孚生物,广州万孚生物技术股份有限公司,生物科技,75655,18160,24.00%,万孚生物(300482),广东省广州市萝岗区科学城荔枝山路8号,广东省广州市萝岗区科学城荔枝山路8号,www.wondfo.com.cn,2015/6/30
广东省,广州市,萝岗区,昊志机电,广州市昊志机电股份有限公司,工业机械,30898,5984,19.40%,昊志机电(300503),广东省广州经济技术开发区永和经济区江东街6号,广东省广州经济技术开发区永和经济区江东街6号,www.haozhihs.com,2016/3/9
广东省,广州市,萝岗区,宏昌电子,宏昌电子材料股份有限公司,特种化工品,81709,3847,4.70%,宏昌电子(603002),广东省广州市萝岗区云埔一路一号之二,广东省广州市萝岗区云埔一路一号之二,www.graceepoxy.com,2012/5/18
广东省,广州市,萝岗区,原尚股份,广东原尚物流股份有限公司,运输服务,28323,4025,14.20%,原尚股份(603813),广东省广州经济技术开发区东区东众路25号,广东省广州经济技术开发区东区东众路25号,www.gsl.cc/main.asp,2017/9/18
广东省,广州市,萝岗区,爱司凯,广州市爱司凯科技股份有限公司,工业机械,13554,3135,23.10%,爱司凯(300521),广东省广州市中新广州知识城九佛建设新街18号自编112房,广东省广州市中新广州知识城九佛建设新街18号自编112房,www.amsky.cc,2016/7/5
广东省,深圳市,罗湖区,平安银行,平安银行股份有限公司,银行业（IV）,7983300,2500000,31.30%,平安银行(000001),广东省深圳市罗湖区深南东路5047号,广东省深圳市罗湖区深南东路5047号,www.bank.pingan.com,1991/4/3
广东省,深圳市,罗湖区,世纪星源,深圳世纪星源股份有限公司,综合公共事业,31423,-965,-3.10%,世纪星源(000005),广东省深圳市人民南路发展中心大厦13层,广东省深圳市罗湖区深南东路2017号华乐大厦3楼,www.fountain.com.cn,1990/12/10
广东省,深圳市,罗湖区,深振业A,深圳市振业(集团)股份有限公司,不动产投资开发,231926,47011,20.30%,深振业A(000006),广东省深圳市罗湖区宝安南路2014号振业大厦B座11-17层,广东省深圳市罗湖区宝安南路2014号振业大厦B座11-17层,www.zhenye.com,1992/4/27
广东省,深圳市,罗湖区,中国宝安,中国宝安集团股份有限公司,不动产投资开发,487312,41915,8.60%,中国宝安(000009),广东省深圳市笋岗东路1002号宝安广场A座28-29层,广东省深圳市笋岗东路1002号宝安广场A座28-29层,www.chinabaoan.com,1991/6/25
广东省,深圳市,罗湖区,深物业A,深圳市物业发展(集团)股份有限公司,不动产投资开发,265273,75235,28.40%,深物业A(000011),广东省深圳市人民南路国贸大厦39、42层,广东省深圳市人民南路国贸大厦39、42层,www.szwuye.com.cn,1992/3/30
广东省,深圳市,罗湖区,特力A,深圳市特力机电股份有限公司,专业零售,23837,3981,16.70%,特力A(000025),广东省深圳市深南中路中核大厦,广东省深圳市深南中路中核大厦十五楼,www.tellus.cn,1993/6/21
广东省,深圳市,罗湖区,深深房A,深圳经济特区房地产(集团)股份有限公司,不动产投资开发,96459,20511,21.30%,深深房A(000029),广东省深圳市人民南路3005号深房广场47楼,广东省深圳市人民南路深房广场46-47楼,www.sfjt.com.cn,1993/9/15
广东省,深圳市,罗湖区,华联控股,华联控股股份有限公司,不动产投资开发,303060,125053,41.30%,华联控股(000036),广东省深圳市深南中路2008号华联大厦11层(1103-1109室),广东省深圳市深南中路2008号华联大厦11层,www.udcgroup.com,1994/6/17
广东省,深圳市,罗湖区,东旭蓝天,东旭蓝天新能源股份有限公司,建筑施工,517972,36404,7.00%,东旭蓝天(000040),广东省深圳市罗湖区东门中路1011号鸿基大厦25-27楼,广东省深圳市罗湖区东门中路1011号鸿基大厦25-27楼,www.bahjdc.com,1994/8/8
广东省,深圳市,罗湖区,世联行,深圳世联行地产顾问股份有限公司,不动产投资开发,519483,79832,15.40%,世联行(002285),广东省深圳市罗湖区深南东路2028号罗湖商务中心12楼,广东省深圳市罗湖区深南东路2028号罗湖商务中心12楼,www.worldunion.com.cn,2009/8/28
广东省,深圳市,罗湖区,洪涛股份,深圳市洪涛装饰股份有限公司,建筑施工,254371,16171,6.40%,洪涛股份(002325),广东省深圳市罗湖区泥岗西洪涛路17号,广东省深圳市罗湖区泥岗西洪涛路17号,www.szhongtao.cn,2009/12/22
广东省,深圳市,罗湖区,广田集团,深圳广田集团股份有限公司,建筑施工,867421,45677,5.30%,广田集团(002482),广东省深圳市罗湖区深南东路2098号,广东省深圳市罗湖区深南东路2098号广田集团大厦,www.szgt.com,2010/9/29
广东省,深圳市,罗湖区,瑞和股份,深圳瑞和建筑装饰股份有限公司,建筑施工,209474,12451,5.90%,瑞和股份(002620),广东省深圳市罗湖区深南东路3027号瑞和大厦,广东省深圳市罗湖区深南东路3027号瑞和研发中心,www.sz-ruihe.com,2011/9/29
广东省,深圳市,罗湖区,国信证券,国信证券股份有限公司,投资服务,874552,453368,51.80%,国信证券(002736),广东省深圳市罗湖区红岭中路1012号国信证券大厦十六层至二十六层,广东省深圳市罗湖区红岭中路1012号国信证券大厦十六层至二十六层,www.guosen.com.cn,2014/12/29
广东省,深圳市,罗湖区,爱迪尔,深圳市爱迪尔珠宝股份有限公司,服装与服饰,149587,6531,4.40%,爱迪尔(002740),广东省深圳市罗湖区东晓路1005号北楼二、三楼,广东省深圳市罗湖区东晓路1005号北楼二、三楼,www.idr.com.cn,2015/1/22
广东省,深圳市,罗湖区,中装建设,深圳市中装建设集团股份有限公司,建筑施工,217001,14112,6.50%,中装建设(002822),广东省深圳市罗湖区深南东路4002号鸿隆世纪广场四-五层（仅限办公）,深圳市罗湖区深南东路4002号鸿隆世纪广场四―五层（仅限办公）,www.zhongzhuang.com,2016/11/29
广东省,深圳市,罗湖区,周大生,周大生珠宝股份有限公司,百货零售,271235,55454,20.40%,周大生(002867),广东省深圳市罗湖区文锦北路田贝花园裙楼商场叁层301,广东省深圳市罗湖区文锦北路田贝花园裙楼商场叁层301,www.chowtaiseng.com,2017/4/27
广东省,深圳市,罗湖区,深物业A,深圳市物业发展(集团)股份有限公司,不动产投资开发,265273,75235,28.40%,深物业B(200011),广东省深圳市人民南路国贸大厦39、42层,广东省深圳市人民南路国贸大厦39、42层,www.szwuye.com.cn,1992/3/30
广东省,深圳市,罗湖区,特力A,深圳市特力机电股份有限公司,专业零售,23837,3981,16.70%,特力B(200025),广东省深圳市深南中路中核大厦,广东省深圳市深南中路中核大厦十五楼,www.tellus.cn,1993/6/21
广东省,深圳市,罗湖区,深深房A,深圳经济特区房地产(集团)股份有限公司,不动产投资开发,96459,20511,21.30%,深深房B(200029),广东省深圳市人民南路3005号深房广场47楼,广东省深圳市人民南路深房广场46-47楼,www.sfjt.com.cn,1993/9/15
广东省,深圳市,罗湖区,今天国际,深圳市今天国际物流技术股份有限公司,计算机服务,40926,7173,17.50%,今天国际(300532),深圳市罗湖区笋岗东路1002宝安广场A座10楼F、G、H,深圳市罗湖区笋岗东路1002宝安广场A座10楼F、G、H,www.nti56.com,2016/8/18
广东省,深圳市,罗湖区,大晟文化,大晟时代文化投资股份有限公司,互联网,16989,6242,36.70%,大晟文化(600892),广东省深圳市罗湖区笋岗街道梨园路6号物资控股置地大厦21层08室,广东省深圳市罗湖区笋岗街道梨园路6号物资控股置地大厦21层08室,--,1996/3/15
广东省,深圳市,罗湖区,广深铁路,广深铁路股份有限公司,铁路运输,1316766,118858,9.00%,广深铁路(601333),广东省深圳市和平路1052号,广东省深圳市和平路1052号,www.gsrc.com,2006/12/22
广东省,深圳市,罗湖区,东方金钰,东方金钰股份有限公司,服装服饰零售,692323,33711,4.90%,东方金钰(600086),湖北省鄂州市鄂城区武昌大道298号,广东省深圳市罗湖区贝丽北路水贝工业区2栋东方金钰珠宝大厦3楼,www.goldjade.cn,1997/6/6
广东省,深圳市,龙华区,华润三九,华润三九医药股份有限公司,制药,748378,113322,15.10%,华润三九(000999),广东省深圳市龙华区观湖街道观澜高新园区观清路1号,广东省深圳市龙华区观澜高新园区观清路1号,www.999.com.cn,2000/3/9
广东省,深圳市,龙华区,京泉华,深圳市京泉华科技股份有限公司,电子电气组件与设备,74791,5745,7.70%,京泉华(002885),广东省深圳市龙华区观澜街道桂月路325号京泉华工业园,广东省深圳市龙华区观澜街道桂月路325号京泉华工业园,www.everrise.net,2017/6/27
广东省,汕头市,龙湖区,万泽股份,万泽实业股份有限公司,不动产投资开发,24159,1640,6.80%,万泽股份(000534),广东省汕头市珠池路23号光明大厦B幢8楼,广东省汕头市珠池路23号光明大厦B幢8楼,--,1994/1/10
广东省,汕头市,龙湖区,超声电子,广东汕头超声电子股份有限公司,电子电气组件与设备,308397,19866,6.40%,超声电子(000823),广东省汕头市龙湖区龙江路12号,广东省汕头市龙湖区龙江路12号,www.gd-goworld.com,1997/10/8
广东省,汕头市,龙湖区,南洋股份,南洋天融信科技集团股份有限公司,电子电气组件与设备,310129,2294,0.70%,南洋股份(002212),广东省汕头市珠津工业区珠津二街1号,广东省汕头市珠津工业区珠津二街1号,www.nanyangcable.com,2008/2/1
广东省,汕头市,龙湖区,潮宏基,广东潮宏基实业股份有限公司,服装与服饰,228993,26967,11.80%,潮宏基(002345),广东省汕头市龙湖区龙新工业区龙新五街四号1-4楼,广东省汕头市龙湖区龙新工业区龙新五街四号1-4楼,www.chjchina.com,2010/1/28
广东省,汕头市,龙湖区,凯撒文化,凯撒(中国)文化股份有限公司,互联网,45919,13034,28.40%,凯撒文化(002425),广东省汕头市龙湖珠津工业区珠津一街3号凯撒工业城,广东省汕头市龙湖珠津工业区珠津一街3号凯撒工业城,www.kaiser.com.cn,2010/6/8
广东省,汕头市,龙湖区,众业达,众业达电气股份有限公司,综合供应商,548812,23762,4.30%,众业达(002441),广东省汕头市衡山路62号,广东省汕头市衡山路62号,www.zyd.cn,2010/7/6
广东省,汕头市,龙湖区,宏辉果蔬,宏辉果蔬股份有限公司,食品零售与批发,52320,5050,9.70%,宏辉果蔬(603336),广东省汕头市龙湖区玉津中路13号,广东省汕头市龙湖区玉津中路13号,www.greatsunfoods.com,2016/11/24
广东省,汕头市,龙湖区,联泰环保,广东联泰环保股份有限公司,水务,13848,5860,42.30%,联泰环保(603797),广东省汕头市中山东路黄厝围龙珠水质净化厂,广东省汕头市中山东路黄厝围龙珠水质净化厂,www.lt-hbgf.com,2017/4/13
广东省,深圳市,龙岗区,兆驰股份,深圳市兆驰股份有限公司,消费电子产品,664813,55897,8.40%,兆驰股份(002429),广东省深圳市龙岗区南湾街道下李朗社区李朗路一号兆驰创新产业园,广东省深圳市深圳市龙岗区南湾街道下李朗社区李朗路一号兆驰创新产业园,www.szmtc.com.cn,2010/6/10
广东省,深圳市,龙岗区,华控赛格,深圳华控赛格股份有限公司,电子电气组件与设备,16600,-415,-2.50%,华控赛格(000068),广东省深圳市大工业区兰竹大道以北CH3主厂房,广东省深圳市大工业区兰竹东路23号,www.ssg.com.cn,1997/6/11
广东省,深圳市,龙岗区,沃尔核材,深圳市沃尔核材股份有限公司,电子设备,175795,11805,6.70%,沃尔核材(002130),广东省深圳市坪山新区兰景北路沃尔工业园,广东省深圳市坪山新区兰景北路沃尔工业园,www.woer.com,2007/4/20
广东省,深圳市,龙岗区,深圳惠程,深圳市惠程电气股份有限公司,电子电气组件与设备,23146,-10969,-47.40%,深圳惠程(002168),广东省深圳市坪山新区大工业区兰景路以东、锦绣路以南惠程科技工业厂区,广东省深圳市龙岗区大工业区兰景路以东、锦绣路以南惠程科技工业厂区,www.hifuture.com,2007/9/19
广东省,深圳市,龙岗区,怡亚通,深圳市怡亚通供应链股份有限公司,综合供应商,4721149,57141,1.20%,怡亚通(002183),广东省深圳市宝安区新安街道兴华路南侧荣超滨海大厦A座1713,广东省深圳市龙岗区南湾街道李朗路3号怡亚通供应链整合物流中心1号楼,www.eascs.com,2007/11/13
广东省,深圳市,龙岗区,通产丽星,深圳市通产丽星股份有限公司,通用化工品,91263,5139,5.60%,通产丽星(002243),广东省深圳市龙岗区龙岗大道(坪地段)1001号,广东省深圳市龙岗区龙岗大道(坪地段)1001号,www.beautystar.cn,2008/5/28
广东省,深圳市,龙岗区,齐心集团,深圳市齐心文具股份有限公司,耐用消费品,220375,10461,4.70%,齐心集团(002301),广东省深圳市福田区福虹路世贸广场A幢17楼05-06号,深圳市坪山新区锦绣中路18号齐心科技园行政大楼,www.comix.com.cn;www.qx.com,2009/10/21
广东省,深圳市,龙岗区,尚荣医疗,深圳市尚荣医疗股份有限公司,医疗设备,151353,19303,12.80%,尚荣医疗(002551),广东省深圳市龙岗区宝龙工业城宝龙5路2号尚荣科技工业园,广东省深圳市龙岗区宝龙工业城宝龙5路2号尚荣科技工业园,www.glory-medical.com.cn,2011/2/25
广东省,深圳市,龙岗区,雷柏科技,深圳雷柏科技股份有限公司,硬件与设备,37441,774,2.10%,雷柏科技(002577),广东省深圳市坪山新区坑梓街道大工业区锦绣东路22号,广东省深圳市坪山新区坑梓街道大工业区锦绣东路22号,www.rapoo.com,2011/4/28
广东省,深圳市,龙岗区,比亚迪,比亚迪股份有限公司,电子电气组件与设备,7393290,410507,5.60%,比亚迪(002594),广东省深圳市大鹏新区葵涌街道延安路一号,广东省深圳市坪山新区比亚迪路3009号,www.byd.com.cn,2011/6/30
广东省,深圳市,龙岗区,雄韬股份,深圳市雄韬电源科技股份有限公司,电子电气组件与设备,197616,6734,3.40%,雄韬股份(002733),广东省深圳市大鹏新区大鹏街道同富工业区雄韬科技园办公楼、1#、2#、3#、8#厂房及9#厂房南栋1至5层,广东省深圳市大鹏新区大鹏街道同富工业区雄韬科技园办公楼、1#、2#、3#、8#厂房及9#厂房南栋1至5层,www.senry-batt.com,2014/12/3
广东省,深圳市,龙岗区,安奈儿,深圳市安奈儿股份有限公司,服装服饰零售,66893,6056,9.10%,安奈儿(002875),广东省深圳市龙岗区坂田街道雪岗路2018号天安云谷产业园一期3栋A座13-17楼,广东省深圳市龙岗区坂田街道雪岗路2018号天安云谷产业园一期3栋A座13-17楼,www.annil.com,2017/6/1
广东省,深圳市,龙岗区,金龙羽,金龙羽集团股份有限公司,电子电气组件与设备,164267,18482,11.30%,金龙羽(002882),广东省深圳市龙岗区吉华街道吉华路288号金龙羽工业园,广东省深圳市龙岗区布吉街道办上水径冷水坑猪肉窝金龙羽工业园,www.szjly.com,2017/7/17
广东省,深圳市,龙岗区,新宙邦,深圳新宙邦科技股份有限公司,特种化工品,127463,23415,18.40%,新宙邦(300037),广东省深圳市坪山区沙?n同富裕工业区,广东省深圳市龙岗区坪山沙?n同富裕工业区,www.capchem.com,2010/1/8
广东省,深圳市,龙岗区,昌红科技,深圳市昌红模具科技股份有限公司,工业机械,41125,2739,6.70%,昌红科技(300151),广东省深圳市坪山新区坪山锦龙大道西侧,广东省深圳市坪山新区坪山锦龙大道西侧,www.sz-changhong.com,2010/12/22
广东省,深圳市,龙岗区,佳士科技,深圳市佳士科技股份有限公司,工业机械,57691,12427,21.50%,佳士科技(300193),广东省深圳市坪山新区青兰一路3号,广东省深圳市坪山新区青兰一路3号,www.jasic.com.cn,2011/3/22
广东省,深圳市,龙岗区,长方集团,深圳市长方集团股份有限公司,电子电气组件与设备,132881,7171,5.40%,长方集团(300301),广东省深圳市坪山新区大工业区聚龙山3号路,广东省深圳市坪山新区大工业区聚龙山3号路,www.cfled.com,2012/3/21
广东省,深圳市,龙岗区,聚飞光电,深圳市聚飞光电股份有限公司,电子电气组件与设备,140372,13194,9.40%,聚飞光电(300303),广东省深圳市龙岗区平湖街道鹅公岭社区鹅岭工业区4号,深圳市龙岗区平湖街道鹅公岭社区鹅岭工业区4号C栋1-3楼、E栋,www.jfled.com.cn,2012/3/19
广东省,深圳市,龙岗区,珈伟股份,深圳珈伟光伏照明股份有限公司,耐用消费品,269287,31483,11.70%,珈伟股份(300317),广东省深圳市龙岗区坪地街道中心社区新发工业区1、2、3、4号,广东省深圳市龙岗区坪地街道中心社区新发工业区1、2、3、4号,www.jiawei.com,2012/5/11
广东省,深圳市,龙岗区,艾比森,深圳市艾比森光电股份有限公司,电子电气组件与设备,88339,4928,5.60%,艾比森(300389),广东省深圳市龙岗区坂田街道雪岗路2018号天安云谷产业园一期3栋A座18、19、20层,广东省深圳市龙岗区坂田街道雪岗路2018号天安云谷产业园一期3栋A座18-20层,www.szabsen.com，www.absen.cn,2014/8/1
广东省,深圳市,龙岗区,太辰光,深圳太辰光通信股份有限公司,电子电气组件与设备,36279,9001,24.80%,太辰光(300570),广东省深圳市福田区车公庙泰然工贸园201栋6楼,深圳市坪山区锦绣中路8号太辰光通信科技园,www.china-tscom.com,2016/12/6
广东省,深圳市,龙岗区,超频三,深圳市超频三科技股份有限公司,电子电气组件与设备,24447,3305,13.50%,超频三(300647),广东省深圳市龙岗区天安数码创业园1号厂房A单元07层A701房,广东省深圳市龙岗区天安数码创业园1号厂房A单元07层A701房,www.pccooler.cn,2017/5/3
广东省,广州市,荔湾区,珠江钢琴,广州珠江钢琴集团股份有限公司,娱乐用品,133595,15315,11.50%,珠江钢琴(002678),广东省广州市增城永宁街香山大道38号,广东省广州市荔湾区花地大道南渔尾西路,www.pearlriverpiano.com,2012/5/30
广东省,广州市,荔湾区,白云山,广州白云山医药集团股份有限公司,制药,1596693,175034,11.00%,白云山(600332),广东省广州市荔湾区沙面北街45号,广东省广州市荔湾区沙面北街45号,www.gybys.com.cn,2001/2/6
广东省,广州市,荔湾区,中船防务,中船海洋与防务装备股份有限公司,商用运载工具与车辆,1549003,-20689,-1.30%,中船防务(600685),广东省广州市荔湾区芳村大道南40号,广东省广州市荔湾区芳村大道南40号,www.chinagsi.com,1993/10/28
广东省,广州市,荔湾区,广州酒家,广州酒家集团股份有限公司,食品与饮料,169022,26167,15.50%,广州酒家(603043),广东省广州市荔湾区中山七路50号西门口广场写字楼第12层（自编层第13层）全层单元,广东省广州市荔湾区中山七路50号西门口广场写字楼第12层（自编层第13层）全层单元,www.gzr.com.cn,2017/6/27
广东省,广州市,荔湾区,大参林,大参林医药集团股份有限公司,药品零售,529940,48830,9.20%,大参林(603233),广东省广州市荔湾区龙溪大道410号、410-1号,广东省广州市荔湾区龙溪大道410号、410-1号,www.dslyy.com,2017/7/31
广东省,广州市,荔湾区,鸿达兴业,鸿达兴业股份有限公司,通用化工品,482137,106805,22.20%,鸿达兴业(002002),江苏省扬州市广陵区杭集镇曙光路,广东省广州市广州圆路1号广州圆大厦28层,www.002002.cn,2004/6/25
广东省,江门市,开平市,华铁股份,广东华铁通达高铁装备股份有限公司,运输服务,103380,20965,20.30%,华铁股份(000976),广东省开平市三埠区港口路10号19幢,广东省开平市长沙港口路10号,www.my0976.com,2000/6/1
广东省,珠海市,金湾区,丽珠集团,珠海经济特区丽珠医药(集团)股份有限公司,制药,652174,515959,79.10%,丽珠集团(000513),广东省珠海市金湾区创业北路38号总部大楼,广东省珠海市金湾区创业北路38号总部大楼,www.livzon.com.cn,1993/10/28
广东省,珠海市,金湾区,恒基达鑫,珠海恒基达鑫国际化工仓储股份有限公司,商业辅助服务,16251,4983,30.70%,恒基达鑫(002492),广东省珠海市高栏港经济区南迳湾,广东省珠海市高栏港经济区南迳湾,www.winbase-tank.com,2010/11/2
广东省,汕头市,金平区,太安堂,广东太安堂药业股份有限公司,制药,221461,23394,10.60%,太安堂(002433),广东省汕头市金园工业区11R2-2片区第1、2座,广东省汕头市金园工业区11R2-2片区第1、2座,www.taiantang.net,2010/6/18
广东省,汕头市,金平区,西陇科学,西陇科学股份有限公司,通用化工品,238892,6816,2.90%,西陇科学(002584),广东省汕头市潮汕路西陇中街1-3号,广东省汕头市潮汕路西陇中街1-3号,www.xlhg.com.cn,2011/6/2
广东省,汕头市,金平区,光华科技,广东光华科技股份有限公司,特种化工品,91579,7981,8.70%,光华科技(002741),广东省汕头市大学路295号,广东省汕头市大学路295号,www.jinhuada.com,2015/2/16
广东省,汕头市,金平区,天际股份,广东天际电器股份有限公司,电子电气组件与设备,64369,17981,27.90%,天际股份(002759),广东省汕头市潮汕路金园工业城12-12片区,广东省汕头市潮汕路金园工业城12－12片区,www.tonze.com,2015/5/28
广东省,汕头市,金平区,金发拉比,金发拉比妇婴童用品股份有限公司,服装与服饰,28409,7491,26.40%,金发拉比(002762),广东省汕头市金平区?D浦?D济南路107号,广东省汕头市金平区?D浦?D济南路107号,www.stjinfa.com,2015/6/10
广东省,汕头市,金平区,金刚玻璃,广东金刚玻璃科技股份有限公司,建材与构件,33585,1682,5.00%,金刚玻璃(300093),广东省汕头市大学路叠金工业区,广东省汕头市大学路叠金工业区,www.golden-glass.cn,2010/7/8
广东省,汕头市,金平区,美联新材,广东美联新材料股份有限公司,通用化工品,31057,4556,14.70%,美联新材(300586),广东省汕头市美联路1号,广东省汕头市美联路1号,www.malion.cn,2017/1/4
广东省,汕头市,金平区,东风股份,汕头东风印刷股份有限公司,商业辅助服务,212365,59954,28.20%,东风股份(601515),广东省汕头市潮汕路金园工业城北郊工业区（二围工业区）、4A2-2片区、2M4片区、13-02片区A-F座,广东省汕头市潮汕路金园工业城,www.dfp.com.cn,2012/2/16
广东省,汕头市,金平区,邦宝益智,广东邦宝益智玩具股份有限公司,玩具,23381,5044,21.60%,邦宝益智(603398),广东省汕头市潮汕路金园工业城13-09片区,广东省汕头市潮汕路金园工业城13-09片区,www.banbao.com,2015/12/9
广东省,揭阳市,揭东区,巨轮智能,巨轮智能装备股份有限公司,工业机械,81436,9193,11.30%,巨轮智能(002031),广东省揭东经济开发区5号路中段,广东省揭东经济开发区5号路中段,www.greatoo.com,2004/8/16
