省,市,区县,公司简称,公司全名,行业,2017前3季度销售额(万）,利润(万）,利润率,股票代码,注册地址,办公地址,官网,上市日期
四川省,成都市,锦江区,恒康医疗,恒康医疗集团股份有限公司,制药,200255,30425,15.20%,恒康医疗(002219),甘肃省陇南市康县王坝独一味工业园区,四川省成都市锦江工业开发区金石路456号,www.duyiwei.com,2008/3/6
四川省,成都市,锦江区,西藏药业,西藏诺迪康药业股份有限公司,制药,64267,11150,17.30%,西藏药业(600211),西藏自治区拉萨市北京中路93号,四川省成都市锦江区三色路427号,www.xzyy.cn,1999/7/21
四川省,成都市,锦江区,新希望,新希望六和股份有限公司,农业与渔业,4586293,270954,5.90%,新希望(000876),四川省绵阳国家高新技术产业开发区,四川省成都市锦江工业园区金石路376号,www.newhopeagri.com,1998/3/11
四川省,成都市,锦江区,北化股份,四川北方硝化棉股份有限公司,通用化工品,142260,6958,4.90%,北化股份(002246),四川省泸州市高坝,四川省成都市锦江工业园三色路209号火炬动力港南区8栋9楼,www.sn-nc.com,2008/6/5
四川省,成都市,锦江区,升达林业,四川升达林业产业股份有限公司,燃气供应,79497,4995,6.30%,升达林业(002259),四川省成都市锦江区东华正街42号,四川省成都市锦江区东华正街42号,www.shengdawood.com,2008/7/16
四川省,成都市,锦江区,山鼎设计,山鼎设计股份有限公司,建筑施工,10026,713,7.10%,山鼎设计(300492),四川省成都市锦江区天仙桥北路3号附1号,四川省成都市锦江区天仙桥北路3号附1号,www.cendes-arch.com,2015/12/23
四川省,成都市,锦江区,西部资源,四川西部资源控股股份有限公司,汽车,18064,-9916,-54.90%,西部资源(600139),四川省绵阳市高新区火炬大厦B区,四川省成都市锦江区锦江工业开发区毕升路168号,www.scxbzy.com,1998/2/25
四川省,成都市,锦江区,博瑞传播,成都博瑞传播股份有限公司,出版业,61263,-4393,-7.20%,博瑞传播(600880),四川省成都市锦江工业园区,四川省成都市锦江区三色路38号“博瑞?创意成都”大厦A座23楼,www.b-raymedia.com,1995/11/15
四川省,成都市,锦江区,新华文轩,新华文轩出版传媒股份有限公司,出版业,501301,68324,13.60%,新华文轩(601811),四川省成都市锦江区金石路239号4栋1层1号,四川省成都市锦江区金石路239号4栋1层1号,www.winshare.com.cn,2016/8/8
