省,市,区县,公司简称,公司全名,行业,2017前3季度销售额(万）,利润(万）,利润率,股票代码,注册地址,办公地址,官网,上市日期
湖南省,岳阳市,岳阳县,凯美特气,湖南凯美特气体股份有限公司,综合公共事业,30429,2919,9.60%,凯美特气(002549),湖南省岳阳市岳阳楼区七里山（巴陵石化化肥事业部西门）,湖南省岳阳市七里山,www.china-kmt.cn,2011-2-18
湖南省,岳阳市,岳阳楼区,恒立实业,恒立实业发展集团股份有限公司,汽车零配件（IV）,3524,-1502,-42.60%,恒立实业(000622),湖南省岳阳市岳阳楼区青年中路9号,湖南省岳阳市金鹗中路228号景源商务中心,www.yyhengli.com,1996-11-7
湖南省,岳阳市,岳阳楼区,岳阳兴长,岳阳兴长石化股份有限公司,通用化工品,106548,840,0.80%,岳阳兴长(000819),湖南省岳阳市云溪区,湖南省岳阳市岳阳大道岳阳兴长大厦九楼,www.yyxc0819.com,1997-6-25
湖南省,岳阳市,岳阳楼区,天润数娱,湖南天润数字娱乐文化传媒股份有限公司,互联网,13068,1778,13.60%,天润数娱(002113),湖南省岳阳市九华山2号,湖南省岳阳市岳阳大道兴长石化大厦6楼,www.trfz.com,2007-2-8
湖南省,岳阳市,岳阳楼区,道道全,道道全粮油股份有限公司,食品生产（IV）,231867,18831,8.10%,道道全(002852),湖南省岳阳经济技术开发区屈原路19号,湖南省岳阳经济技术开发区营盘岭路113号,www.ddqly.com,2017-3-10
湖南省,岳阳市,岳阳楼区,中科电气,湖南中科电气股份有限公司,工业机械,27302,4689,17.20%,中科电气(300035),湖南省岳阳经济技术开发区岳阳大道中科工业园,湖南省岳阳市岳阳大道中科工业园,www.cseco.cn,2009-12-25
湖南省,岳阳市,岳阳楼区,岳阳林纸,岳阳林纸股份有限公司,造纸,405451,25801,6.40%,岳阳林纸(600963),湖南省岳阳市岳阳楼区城陵矶光明路,湖南省岳阳市城陵矶洪家洲,www.yypaper.com,2004-5-25
湖南省,岳阳市,岳阳楼区,百利科技,湖南百利工程科技股份有限公司,工业工程,42826,6897,16.10%,百利科技(603959),湖南省岳阳市岳阳楼区洞庭大道1号,湖南省岳阳市岳阳楼区洞庭大道1号,www.blest.com.cn,2016-5-17
湖南省,岳阳市,汨罗市,正虹科技,湖南正虹科技发展股份有限公司,农业与渔业,97067,1083,1.10%,正虹科技(000702),湖南省岳阳市屈原管理区营田镇,湖南省岳阳市屈原管理区营田镇正虹科技大楼,www.chinazhjt.com.cn,1997-3-18
