省,市,区县,公司简称,公司全名,行业,2017前3季度销售额(万）,利润(万）,利润率,股票代码,注册地址,办公地址,官网,上市日期
山东省,济宁市,邹城市,兖州煤业,兖州煤业股份有限公司,煤炭开采,11921862,657771,5.50%,兖州煤业(600188),山东省邹城市凫山南路298号,山东省邹城市凫山南路298号,www.yanzhoucoal.com.cn,1998/7/1
山东省,济宁市,兖州市,太阳纸业,山东太阳纸业股份有限公司,造纸,1370592,194672,14.20%,太阳纸业(002078),山东省兖州市西关大街66号,山东省兖州市友谊路1号,www.sunpapergroup.com,2006/11/16
山东省,济宁市,市中区,鲁抗医药,山东鲁抗医药股份有限公司,制药,188413,4680,2.50%,鲁抗医药(600789),山东省济宁市太白楼西路173号,山东省济宁市太白楼西路152号,www.lkpc.com,1997/2/26
山东省,济宁市,任城区,辰欣药业,辰欣药业股份有限公司,医药与生物科技,196421,22801,11.60%,辰欣药业(603367),山东省济宁高新区同济科技工业园,山东省济宁高新区同济科技工业园,www.lkcisen.com,2017/9/29
山东省,济宁市,曲阜市,圣阳股份,山东圣阳电源股份有限公司,电子电气组件与设备,119860,2193,1.80%,圣阳股份(002580),山东省曲阜市圣阳路1号,山东省曲阜市圣阳路1号,www.sacredsun.cn,2011/5/6
山东省,济宁市,曲阜市,东宏股份,山东东宏管业股份有限公司,基础材料,95254,11626,12.20%,东宏股份(603856),山东省曲阜市东宏路1号,山东省曲阜市东宏路1号,www.dhguanye.com,2017/11/6
山东省,济宁市,高新区,山推股份,山推工程机械股份有限公司,商用运载工具与车辆,490730,4996,1.00%,山推股份(000680),山东省济宁市高新区327国道58号,山东省济宁市高新区327国道58号,www.shantui.com,1997/1/22
山东省,济宁市,高新区,如意集团,山东如意毛纺服装集团股份有限公司,服装与服饰,73033,3521,4.80%,如意集团(002193),山东省济宁市高新区如意工业园,山东省济宁市高新区如意工业园,www.shandongruyi.com,2007/12/7
