省,市,区县,公司简称,公司全名,行业,2017前3季度销售额(万）,利润(万）,利润率,股票代码,注册地址,办公地址,官网,上市日期
河南省,郑州市,中原区,新天科技,新天科技股份有限公司,工业机械,46809,11266,24.10%,新天科技(300259),河南省郑州高新技术产业开发区国槐街19号,河南省郑州国家级高新技术产业开发区红松路252号,www.suntront.com,2011-8-31
河南省,郑州市,中原区,汉威科技,汉威科技集团股份有限公司,工业机械,100401,11711,11.70%,汉威科技(300007),河南省郑州高新技术开发区雪松路169号,河南省郑州高新技术开发区雪松路169号,www.hwsensor.com,2009-10-30
河南省,郑州市,中原区,豫金刚石,郑州华晶金刚石股份有限公司,工业机械,96792,17182,17.80%,豫金刚石(300064),河南省郑州市高新开发区冬青街24号,河南省郑州市高新开发区长椿路23号郑州高新企业加速器产业园C5-1/2楼,www.sinocrystal.com.cn,2010-3-26
河南省,郑州市,中原区,新开普,新开普电子股份有限公司,软件,42664,4553,10.70%,新开普(300248),河南省郑州高新技术产业开发区迎春街18号,河南省郑州高新技术产业开发区迎春街18号,www.newcapec.com.cn,2011-7-29
河南省,郑州市,中原区,光力科技,光力科技股份有限公司,工业机械,11458,2323,20.30%,光力科技(300480),河南省郑州高新开发区长椿路10号,河南省郑州高新开发区长椿路10号,www.gltech.cn,2015-7-2
河南省,郑州市,中原区,*ST郑煤,郑州煤电股份有限公司,煤炭开采,450376,93238,20.70%,*ST郑煤(600121),河南省郑州市中原西路188号,河南省郑州市中原西路188号,www.zzce.com.cn,1998-1-7
