省,市,区县,公司简称,公司全名,行业,2017前3季度销售额(万）,利润(万）,利润率,股票代码,注册地址,办公地址,官网,上市日期
上海市,虹口区,虹口区,新文化,上海新文化传媒集团股份有限公司,广播与娱乐,90270,24642,27.30%,新文化(300336),上海市虹口区东江湾路444号北区238室,上海市虹口区东江湾路444号北区238室,www.ncmedia.com.cn,2012/7/10
上海市,虹口区,虹口区,上港集团,上海国际港务（集团）股份有限公司,运输服务,2521535,706474,28.00%,上港集团(600018),上海市浦东新区芦潮港镇同汇路1号综合大楼4楼,上海市虹口区东大名路358号国际港务大厦,www.portshanghai.com.cn,2000/7/19
上海市,虹口区,虹口区,上海建工,上海建工集团股份有限公司,建筑施工,9953938,207594,2.10%,上海建工(600170),上海市浦东新区福山路33号,上海市虹口区东大名路666号,www.scg.com.cn,1998/6/23
上海市,虹口区,虹口区,城投控股,上海城投控股股份有限公司,不动产投资开发,173046,126103,72.90%,城投控股(600649),上海市浦东新区北艾路1540号,上海市吴淞路130号城投控股大厦19楼,www.sh600649.com,1993/5/18
上海市,虹口区,虹口区,兰生股份,上海兰生股份有限公司,综合供应商,248316,12504,5.00%,兰生股份(600826),上海市浦东新区陆家嘴东路161号2602室,上海市中山北二路1800号,www.lansheng.com,1994/2/4
上海市,虹口区,虹口区,同济科技,上海同济科技实业股份有限公司,建筑施工,216984,17951,8.30%,同济科技(600846),上海市浦东新区栖山路33号,上海市四平路1398号同济联合广场B座20层,www.tjkjsy.com.cn,1994/3/11
上海市,虹口区,虹口区,润达医疗,上海润达医疗科技股份有限公司,医疗用品,292652,28944,9.90%,润达医疗(603108),上海市金山区卫昌路1018号1号楼201室,上海市虹口区乍浦路89号星荟中心1座8楼,www.rundamedical.com,2015/5/27
上海市,虹口区,虹口区,中远海控,中远海运控股股份有限公司,水上运输,6759875,456744,6.80%,中远海控(601919),天津市天津空港经济区中心大道与东七道交口远航商务中心12号楼二层,上海市东大名路658号8楼,www.chinacosco.com,2007/6/26
上海市,虹口区,虹口区,大康农业,湖南大康国际农业食品股份有限公司,农业与渔业,996486,6649,0.70%,大康农业(002505),湖南省怀化市鹤城区鸭嘴岩工业园3栋,上海市虹口区东大名路948号白金湾广场18楼,www.dakangmuye.com,2010/11/18
