省,市,区县,公司简称,公司全名,行业,2017前3季度销售额(万）,利润(万）,利润率,股票代码,注册地址,办公地址,官网,上市日期
江苏省,泰州市,泰兴市,济川药业,湖北济川药业股份有限公司,制药,421362,98588,23.40%,济川药业(600566),湖北省荆州市沙市区园林路时尚豪庭602室,江苏省泰兴市大庆西路宝塔湾,www.jumpcan.com,2001/8/22
江苏省,泰州市,靖江市,亚星锚链,江苏亚星锚链股份有限公司,商用运载工具与车辆,77286,3891,5.00%,亚星锚链(601890),江苏省靖江市东兴镇何德村,江苏省靖江市东兴镇何德村江苏亚星锚链股份有限公司办公楼,www.anchor-chain.com,2010/12/28
江苏省,泰州市,靖江市,万林股份,江苏万林现代物流股份有限公司,运输服务,42109,11253,26.70%,万林股份(603117),江苏省靖江市经济开发区新港园区六助港路5号,江苏省靖江市人民中路68号国贸中心8楼A、B座,www.china-wanlin.com,2015/6/29
江苏省,泰州市,靖江市,华达科技,华达汽车科技股份有限公司,汽车与零配件（II）,223128,20592,9.20%,华达科技(603358),江苏省靖江市江平路51号,江苏省靖江市江平路51号,www.hdqckj.com,2017/1/25
江苏省,泰州市,姜堰区,精锻科技,江苏太平洋精锻科技股份有限公司,汽车零配件（IV）,80048,22687,28.30%,精锻科技(300258),江苏省泰州市姜堰区姜堰大道91号,江苏省泰州市姜堰区双登大道198号,www.ppforging.com,2011/8/26
江苏省,泰州市,海陵区,林海股份,林海股份有限公司,汽车,32380,362,1.10%,林海股份(600099),江苏省泰州市迎春西路199号,江苏省泰州市迎春西路199号,www.linhai.cn,1997/7/4
江苏省,泰州市,海陵区,春兰股份,江苏春兰制冷设备股份有限公司,耐用消费品,43946,2550,5.80%,春兰股份(600854),江苏省泰州市春兰工业园区春兰路1号,江苏省泰州市春兰工业园区春兰路1号,www.chunlan.com,1994/4/25
