省,市,区县,公司简称,公司全名,行业,2017前3季度销售额(万）,利润(万）,利润率,股票代码,注册地址,办公地址,官网,上市日期
贵州省,安顺市,镇宁县,红星发展,贵州红星发展股份有限公司,通用化工品,99524,8856,8.90%,红星发展(600367),贵州省安顺市镇宁县丁旗镇,贵州省安顺市镇宁县丁旗镇,www.hxfz.com.cn,2001-3-20
贵州省,贵阳市,云岩区,黔轮胎A,贵州轮胎股份有限公司,轮胎,503714,-19149,-3.80%,黔轮胎A(000589),贵州省贵阳市百花大道41号,贵州省贵阳市百花大道41号,www.gztire.com,1996-3-8
贵州省,贵阳市,云岩区,久联发展,贵州久联民爆器材发展股份有限公司,特种化工品,307166,10649,3.50%,久联发展(002037),贵州省贵阳市高新技术开发区新天园区,贵州省贵阳市宝山北路213号,www.gzjiulian.com/,2004-9-8
贵州省,贵阳市,云岩区,贵州燃气,贵州燃气集团股份有限公司,燃气、水与综合,191790,10824,5.60%,贵州燃气(600903),贵州省贵阳市云岩区中华中路166-1号,贵州省贵阳市云岩区新添大道南段298号,www.guizhougas.com,2017-11-7
贵州省,贵阳市,云岩区,贵阳银行,贵阳银行股份有限公司,银行业（II）,897595,370515,41.30%,贵阳银行(601997),贵州省贵阳市中华北路77号,贵州省贵阳市中华北路77号,www.bankgy.cn,2016-8-16
贵州省,贵阳市,云岩区,永吉股份,贵州永吉印务股份有限公司,媒介代理,22193,6801,30.60%,永吉股份(603058),贵州省贵阳市云岩区观山东路198号,贵州省贵阳市云岩区观山东路198号,www.gz-yongji.com,2016-12-23
贵州省,贵阳市,小河区,贵航股份,贵州贵航汽车零部件股份有限公司,汽车零配件（IV）,238847,13582,5.70%,贵航股份(600523),贵州省贵阳市小河区清水江路1号,贵州省贵阳市小河区珠江路166号,www.ghgf.com.cn,2001-12-27
贵州省,安顺市,西秀区,贵州百灵,贵州百灵企业集团制药股份有限公司,制药,174757,40638,23.30%,贵州百灵(002424),贵州省安顺市经济技术开发区西航大道,贵州省安顺市经济技术开发区西航大道,www.gzbl.com,2010-6-3
贵州省,贵阳市,乌当区,新天药业,贵阳新天药业股份有限公司,医药与生物科技,52549,6542,12.50%,新天药业(002873),贵州省贵阳市贵阳国家高新技术产业开发区新添大道114号,贵州省贵阳市国家高新技术产业开发区新添大道114号,www.liqundepartmentstore.com,2017-5-19
贵州省,贵阳市,乌当区,中天金融,中天金融集团股份有限公司,不动产投资开发,1100611,181051,16.50%,中天金融(000540),贵州省贵阳市观山湖区中天路3号,贵州省贵阳市观山湖区中天路3号201中心,www.ztcn.cn,1994-2-2
贵州省,贵阳市,乌当区,振华科技,中国振华(集团)科技股份有限公司,电子电气组件与设备,621392,18834,3.00%,振华科技(000733),贵州省贵阳市乌当区新添大道北段268号,贵州省贵阳市乌当区新添大道北段268号,www.czst.com.cn,1997-7-3
贵州省,贵阳市,乌当区,南方汇通,南方汇通股份有限公司,通用化工品,78651,11548,14.70%,南方汇通(000920),贵州省贵阳市国家高新技术产业开发区,贵州省贵阳市乌当区高新路126号,www.crrcgc.cc/ht,1999-6-16
贵州省,贵阳市,乌当区,信邦制药,贵州信邦制药股份有限公司,制药,437636,31035,7.10%,信邦制药(002390),贵州省黔南布依布依族苗族自治州罗甸县龙坪镇解放路96号,贵州省贵阳市乌当区新添大道与航天大道交汇处科开1号苑6楼,www.xinbang.com,2010-4-16
贵州省,贵阳市,乌当区,朗玛信息,贵阳朗玛信息技术股份有限公司,计算机服务,193903,39592,20.40%,朗玛信息(300288),贵州省贵阳市高新金阳科技产业园长岭南路31号(国家数字内容产业园二楼),贵州省贵阳市观山湖区长岭南路31号国家数字内容产业园二楼,www.longmaster.com.cn,2012-2-16
贵州省,贵阳市,乌当区,赤天化,贵州赤天化股份有限公司,制药,108420,-729,-0.70%,赤天化(600227),贵州省贵阳市乌当区新添大道310号,贵州省贵阳市观山湖区阳关大道28号赤天化大厦17楼,www.chth.com.cn,2000-2-21
贵州省,贵阳市,乌当区,益佰制药,贵州益佰制药股份有限公司,制药,287451,36380,12.70%,益佰制药(600594),贵州省贵阳市白云大道220-1号,贵州省贵阳市白云大道220-1号,www.gzcci.com,2004-3-23
贵州省,贵阳市,乌当区,中航重机,中航重机股份有限公司,工业机械,410256,18975,4.60%,中航重机(600765),贵州省贵阳市乌当区北衙路501号,贵州省贵阳市乌当区北衙路501号,www.hm.avic.com,1996-11-6
贵州省,贵阳市,乌当区,贵广网络,贵州省广播电视信息网络股份有限公司,通讯设备,175212,33238,19.00%,贵广网络(600996),贵州省贵阳市观山湖区金阳南路36号,贵州省贵阳市观山湖区金阳南路36号,www.gzgdwl.com,2016-12-26
贵州省,遵义市,仁怀市,贵州茅台,贵州茅台酒股份有限公司,蒸馏酒与葡萄酒,4245047,2863694,67.50%,贵州茅台(600519),贵州省仁怀市茅台镇,贵州省仁怀市茅台镇,www.moutaichina.com,2001-8-27
贵州省,六盘水市,盘县,盘江股份,贵州盘江精煤股份有限公司,煤炭开采,435115,72901,16.80%,盘江股份(600395),贵州省六盘水市红果经济开发区,贵州省六盘水市红果经济开发区干沟桥,http://58.42.206.23,2001-5-31
贵州省,贵阳市,南明区,黔源电力,贵州黔源电力股份有限公司,电力（IV）,205149,64797,31.60%,黔源电力(002039),贵州省贵阳市都司高架桥路46号黔源大厦,贵州省贵阳市南明区都司高架桥路46号黔源大厦,www.gzqydl.cn,2005-3-3
贵州省,遵义市,汇川区,*ST天成,贵州长征天成控股股份有限公司,电子电气组件与设备,47826,1261,2.60%,*ST天成(600112),贵州省遵义市武汉路临1号,贵州省遵义市武汉路1号(长征电气工业园),www.czdq.cn,1997-11-27
贵州省,贵阳市,花溪区,航天电器,贵州航天电器股份有限公司,电子电气组件与设备,180115,27471,15.30%,航天电器(002025),贵州省贵阳经济技术开发区红河路7号,贵州省贵阳经济技术开发区红河路7号,www.gzhtdq.com.cn,2004-7-26
贵州省,贵阳市,花溪区,勘设股份,贵州省交通规划勘察设计研究院股份有限公司,建筑施工,129318,30136,23.30%,勘设股份(603458),贵州省贵阳市贵阳国家高新技术产业开发区阳关大道附100号,贵州省贵阳市高新技术产业开发区阳关大道附100号,www.gzjtsjy.com,2017-8-9
贵州省,遵义市,红花岗区,贵绳股份,贵州钢绳股份有限公司,钢铁,127258,1674,1.30%,贵绳股份(600992),贵州省遵义市桃溪路47号,贵州省遵义市桃溪路47号,www.gzgsgf.com.cn,2004-5-14
贵州省,黔南布依族苗族自治州,福泉市,川恒股份,贵州川恒化工股份有限公司,通用化工品,89362,14432,16.10%,川恒股份(002895),贵州省黔南布依族苗族自治州福泉市龙昌镇,贵州省黔南布依族苗族自治州福泉市龙昌镇,www.chanphos.com,2017-8-25
