省,市,区县,公司简称,公司全名,行业,2017前3季度销售额(万）,利润(万）,利润率,股票代码,注册地址,办公地址,官网,上市日期
广东省,广州市,海珠区,东凌国际,广州东凌国际投资股份有限公司,食品生产（IV）,110735,-3775,-3.40%,东凌国际(000893),广东省广州市南沙区万顷沙镇红安路3号,广东省广州市海珠区新港东路1166号环汇商业广场南塔19层,www.dongling.cn,1998-12-24
广东省,广州市,海珠区,省广股份,广东省广告股份有限公司,媒介代理,701496,24116,3.40%,省广股份(002400),广东省广州市越秀区东风东路745号之二,广东省广州市海珠区新港东路996号保利世界贸易中心G座,www.gdadc.com,2010-5-6
广东省,广州市,海珠区,珠江啤酒,广州珠江啤酒股份有限公司,酿酒业,309339,18785,6.10%,珠江啤酒(002461),广东省广州市海珠区新港东路磨碟沙大街118号,广东省广州市海珠区新港东路磨碟沙大街118号,www.zhujiangbeer.com,2010-8-18
广东省,广州市,海珠区,杰赛科技,广州杰赛科技股份有限公司,通讯设备,214818,3156,1.50%,杰赛科技(002544),广东省广州市新港中路381号,广东省广州市新港中路381号杰赛科技大楼,www.chinagci.com,2011-1-28
广东省,广州市,海珠区,万里马,广东万里马实业股份有限公司,鞋类,40172,3062,7.60%,万里马(300591),东莞市长安镇建安路367号,广州市海珠区新港东路1028号保利世界贸易中心F座2、3层,www.wanlima.com.cn,2017-1-10
广东省,广州市,海珠区,保利地产,保利房地产(集团)股份有限公司,不动产投资开发,7554048,1395846,18.50%,保利地产(600048),广东省广州市海珠区阅江中路688号保利国际广场北塔30-33层,广东省广州市海珠区阅江中路688号保利国际广场北塔30-33层,www.polycn.com;www.gzpoly.com,2006-7-31
广东省,广州市,海珠区,金域医学,广州金域医学检验集团股份有限公司,医疗保健服务,279998,19151,6.80%,金域医学(603882),广东省广州市国际生物岛螺旋三路10号,广东省广州市国际生物岛螺旋三路10号,www.kingmed.com.cn,2017-9-8
