省,市,区县,公司简称,公司全名,行业,2017前3季度销售额(万）,利润(万）,利润率,股票代码,注册地址,办公地址,官网,上市日期
山东省,青岛市,四方区,赛轮金宇,赛轮金宇集团股份有限公司,轮胎,1026193,20442,2.00%,赛轮金宇(601058),山东省青岛市黄岛区茂山路588号,山东省青岛市四方区郑州路43号橡胶谷B栋,www.sailuntyre.com.cn,2011/6/30
山东省,青岛市,市南区,青岛啤酒,青岛啤酒股份有限公司,酿酒业,2338499,272060,11.60%,青岛啤酒(600600),山东省青岛市市北区登州路56号,山东省青岛市香港中路五四广场青啤大厦,www.tsingtao.com.cn,1993/8/27
山东省,青岛市,市南区,鼎信通讯,青岛鼎信通讯股份有限公司,通讯设备,89905,25567,28.40%,鼎信通讯(603421),山东省青岛市市南区宁夏路288号6号楼5楼B区,山东省青岛市市南区宁夏路288号6号楼5楼B区,www.topscomm.com,2016/10/11
山东省,青岛市,市北区,软控股份,软控股份有限公司,工业机械,190946,3110,1.60%,软控股份(002073),山东省青岛市高新区新业路31号远创国际蓝湾创意园B区1号楼202室,山东省青岛市郑州路43号,www.mesnac.com,2006/10/18
山东省,青岛市,市北区,东软载波,青岛东软载波科技股份有限公司,软件,61041,17181,28.10%,东软载波(300183),山东省青岛市市北区上清路16号甲,山东省青岛市市北区上清路16号甲,www.eastsoft.com.cn,2011/2/22
山东省,青岛市,崂山区,青岛金王,青岛金王应用化学股份有限公司,通用化工品,323833,44808,13.80%,青岛金王(002094),山东省青岛即墨市青岛环保产业园,山东省青岛市崂山区香港东路195号上实中心T3楼15、16楼,www.chinakingking.com,2006/12/15
山东省,青岛市,崂山区,汉缆股份,青岛汉缆股份有限公司,电子电气组件与设备,335174,25574,7.60%,汉缆股份(002498),山东省青岛市崂山区九水东路628号,山东省青岛市崂山区九水东路628号,www.hanhe-cable.com,2010/11/9
山东省,青岛市,崂山区,特锐德,青岛特锐德电气股份有限公司,电子电气组件与设备,380180,8789,2.30%,特锐德(300001),山东省青岛市崂山区松岭路336号,山东省青岛市崂山区松岭路336号,www.qdtgood.com,2009/10/30
山东省,青岛市,崂山区,华仁药业,华仁药业股份有限公司,制药,91421,3721,4.10%,华仁药业(300110),山东省青岛市高科技工业园株洲路187号,山东省青岛市高科技工业园株洲路187号,www.qdhuaren.com,2010/8/25
山东省,青岛市,崂山区,城市传媒,青岛城市传媒股份有限公司,出版业,135630,18330,13.50%,城市传媒(600229),山东省青岛市市南区香港中路67号,山东省青岛市崂山区海尔路182号,www.citymedia.cn,2000/3/9
山东省,青岛市,崂山区,青岛海尔,青岛海尔股份有限公司,耐用消费品,11918961,758832,6.40%,青岛海尔(600690),山东省青岛市崂山区海尔工业园内,山东省青岛市崂山区海尔信息产业园内,www.haier.com,1993/11/19
山东省,青岛市,崂山区,新华锦,山东新华锦国际股份有限公司,服装与服饰,98691,10588,10.70%,新华锦(600735),山东省青岛市崂山区秦岭路18号,山东省青岛市崂山区松岭路127号,--,1996/7/26
山东省,青岛市,崂山区,利群股份,青岛利群百货集团股份有限公司,百货零售,776202,38100,4.90%,利群股份(601366),山东省青岛经济技术开发区香江路78号,山东省青岛市崂山区海尔路83号,www.liqundepartmentstore.com,2017/4/12
山东省,青岛市,崂山区,康普顿,青岛康普顿科技股份有限公司,汽车与零配件（II）,69246,12693,18.30%,康普顿(603798),山东省青岛市崂山区深圳路18号,山东省青岛市崂山区深圳路18号,www.copton.com.cn,2016/4/6
山东省,青岛市,崂山区,中鲁B(200992),,{d1},{d2},#VALUE!,中鲁B(200992),山东省青岛市崂山区苗岭路29号,山东省青岛市崂山区海尔路65号招行财富大厦,,,
山东省,青岛市,胶州市,东方铁塔,青岛东方铁塔股份有限公司,建材与构件,136883,18640,13.60%,东方铁塔(002545),山东省胶州市广州北路318号,山东省胶州市广州北路318号,www.qddftt.cn,2011/2/11
山东省,青岛市,胶州市,天能重工,青岛天能重工股份有限公司,电子电气组件与设备,47270,8349,17.70%,天能重工(300569),山东省青岛胶州市李哥庄镇大沽河工业园,山东省青岛胶州市李哥庄镇大沽河工业园,www.qdtnp.com,2016/11/25
山东省,青岛市,胶州市,汇金通,青岛汇金通电力设备股份有限公司,电力（III）,56240,4117,7.30%,汇金通(603577),山东省青岛胶州市铺集镇东部工业区,青岛胶州市铺集镇东部工业区,www.hjttower.com,2016/12/22
山东省,青岛市,即墨市,海联金汇,海联金汇科技股份有限公司,工业机械,258595,31795,12.30%,海联金汇(002537),山东省青岛即墨市青威路1626号,山东省青岛即墨市青威路1626号,www.haili.com.cn,2011/1/10
山东省,青岛市,即墨市,伟隆股份,青岛伟隆阀门股份有限公司,工业机械,20258,5065,25.00%,伟隆股份(002871),山东省青岛即墨市蓝村镇兴和路45号,山东省青岛即墨市蓝村镇兴和路45号,www.weilongvalve.com,2017/5/11
山东省,青岛市,即墨市,英派斯,青岛英派斯健康科技股份有限公司,工业机械,56459,6960,12.30%,英派斯(002899),山东省青岛市即墨市华山二路369号,山东省青岛市即墨市华山二路369号,www.impulsefitness.com,2017/9/15
山东省,青岛市,黄岛区,青岛双星,青岛双星股份有限公司,轮胎,301875,6884,2.30%,青岛双星(000599),山东省青岛市黄岛区两河路666号,山东省青岛市黄岛区大连路577号15楼,www.doublestar.com.cn,1996/4/30
山东省,青岛市,黄岛区,海信电器,青岛海信电器股份有限公司,消费电子产品,2374604,71482,3.00%,海信电器(600060),山东省青岛市经济技术开发区前湾港路218号,山东省青岛市经济技术开发区前湾港路218号,www.hisense.com,1997/4/22
山东省,青岛市,黄岛区,澳柯玛,澳柯玛股份有限公司,耐用消费品,357256,5424,1.50%,澳柯玛(600336),山东省青岛经济技术开发区前湾港路315号,山东省青岛经济技术开发区前湾港路315号,www.aucma.com.cn,2000/12/29
山东省,青岛市,城阳区,国恩股份,青岛国恩科技股份有限公司,通用化工品,137451,15487,11.30%,国恩股份(002768),山东省青岛市城阳区棘洪滩街道青大工业园2号路,山东省青岛市城阳区棘洪滩街道青大工业园2号路,www.qdgon.com,2015/6/30
山东省,青岛市,城阳区,恒顺众?N,青岛市恒顺众?N集团股份有限公司,电子电气组件与设备,113539,37352,32.90%,恒顺众?N(300208),山东省青岛市城阳区流亭街道双元路西侧（空港工业聚集区）,山东省青岛市城阳区流亭街道双元路西侧（空港工业聚集区）,www.qdhengshun.com,2011/4/26
山东省,青岛市,城阳区,天华院,青岛天华院化学工程股份有限公司,工业机械,27207,-3765,-13.80%,天华院(600579),山东省青岛市城阳区棘洪滩金岭工业园3号,山东省青岛市城阳区棘洪滩金岭工业园3号,www.thy .chemchina.com,2002/8/9
山东省,青岛市,城阳区,海利尔,海利尔药业集团股份有限公司,特种化工品,115009,24112,21.00%,海利尔(603639),山东省青岛市城阳区城东工业园内,山东省青岛市城阳区城东工业园内,www.hailir.cn,2017/1/12
