省,市,区县,公司简称,公司全名,行业,2017前3季度销售额(万）,利润(万）,利润率,股票代码,注册地址,办公地址,官网,上市日期
江苏省,南京市,六合区,金浦钛业,金浦钛业股份有限公司,特种化工品,130506,15415,11.80%,金浦钛业(000545),吉林省吉林市吉林经济技术开发区吉孤公路480号,江苏省南京市六合区南京化工园大玮东路229号,www.nthcl.com,1993/12/15
江苏省,南京市,六合区,中旗股份,江苏中旗科技股份有限公司,通用化工品,90717,9831,10.80%,中旗股份(300575),江苏省南京市南京化学工业园区长丰河路309号,江苏省南京市南京化学工业园区长丰河路309号,www.flagchem.com,2016/12/20
江苏省,南京市,六合区,南钢股份,南京钢铁股份有限公司,钢铁,2707174,228523,8.40%,南钢股份(600282),江苏省南京市六合区卸甲甸,江苏省南京市六合区卸甲甸,www.600282.net,2000/9/19
江苏省,南京市,六合区,南京化纤,南京化纤股份有限公司,通用化工品,126776,8341,6.60%,南京化纤(600889),江苏省南京市六合区雄州街道郁庄路2号,江苏省南京市六合区瓜埠镇新材料产业园,www.ncfc.cn,1996/3/8
江苏省,南京市,六合区,基蛋生物,基蛋生物科技股份有限公司,医疗用品,33022,15226,46.10%,基蛋生物(603387),江苏省南京市六合区沿江工业开发区博富路9号,江苏省南京市六合区沿江工业开发区博富路9号,www.bio-gp.com.cn,2017/7/17
