省,市,区县,公司简称,公司全名,行业,2017前3季度销售额(万）,利润(万）,利润率,股票代码,注册地址,办公地址,官网,上市日期
江苏省,常州市,新北区,东北电气,东北电气发展股份有限公司,电子电气组件与设备,2243,-3759,-167.60%,东北电气(000585),,江苏省常州市新北区太湖东路9号4幢23层,江苏省常州市新北区太湖东路9号4幢23层,www.nee.com.cn;www.nee.hk,1995-12-13
江苏省,常州市,新北区,千红制药,常州千红生化制药股份有限公司,生物科技,75715,20521,27.10%,千红制药(002550),,江苏省常州市新北区云河路518号,江苏省常州市新北区长江中路90号,www.qhsh.com.cn,2011-2-18
江苏省,常州市,新北区,光洋股份,常州光洋轴承股份有限公司,汽车与零配件（II）,103535,2452,2.40%,光洋股份(002708),,江苏省常州市新北区汉江路52号,江苏省常州市新北区汉江路52号,www.nrb.com.cn,2014-1-21
江苏省,常州市,新北区,维尔利,江苏维尔利环保科技股份有限公司,综合公共事业,84388,11767,13.90%,维尔利(300190),,江苏省常州新北区汉江路156号,江苏省常州新北区汉江路156号,www.jswelle.com.cn,2011-3-16
江苏省,常州市,新北区,星宇股份,常州星宇车灯股份有限公司,汽车零配件（IV）,300739,36950,12.30%,星宇股份(601799),,江苏省常州市新北区汉江路398号,江苏省常州市新北区秦岭路182号,www.xyl.cn,2011-2-1
江苏省,常州市,新北区,新泉股份,江苏新泉汽车饰件股份有限公司,汽车零配件（IV）,224411,19916,8.90%,新泉股份(603179),,江苏省丹阳市丹北镇长春村,江苏省常州市漓江路18号,www.xinquan.cn,2017-3-17
江苏省,常州市,新北区,永安行,常州永安公共自行车系统股份有限公司,公路运输,75111,10366,13.80%,永安行(603776),,江苏省常州市新北区汉江路400号,江苏省常州市新北区黄河中路132号4号楼,www.ibike668.com,2017-8-17
