省,市,区县,公司简称,公司全名,行业,2017前3季度销售额(万）,利润(万）,利润率,股票代码,注册地址,办公地址,官网,上市日期
浙江省,嘉兴市,嘉善县,巴士在线,巴士在线股份有限公司,电子电气组件与设备,53640,6918,12.90%,巴士在线(002188),浙江省嘉善县经济开发区东升路36号,浙江省嘉善县经济开发区东升路36号,www.busonline.com,2007-11-22
浙江省,嘉兴市,嘉善县,浙江众成,浙江众成包装材料股份有限公司,特种化工品,46395,6332,13.60%,浙江众成(002522),浙江省嘉善县惠民街道泰山路1号,浙江省嘉善县惠民街道泰山路1号,www.zjzhongda.com,2010-12-10
浙江省,嘉兴市,嘉善县,田中精机,浙江田中精机股份有限公司,工业机械,36722,4608,12.50%,田中精机(300461),浙江省嘉善县姚庄镇新景路398号,浙江省嘉善县姚庄镇新景路398号,www.tanac.com.cn,2015-5-19
浙江省,嘉兴市,嘉善县,长盛轴承,浙江长盛滑动轴承股份有限公司,工业机械,41863,11066,26.40%,长盛轴承(300718),浙江省嘉善县惠民街道鑫达路6号,浙江省嘉善县惠民街道鑫达路6号,www.csb.com.cn,2017-11-6
浙江省,嘉兴市,嘉善县,晋亿实业,晋亿实业股份有限公司,工业机械,211124,21304,10.10%,晋亿实业(601002),浙江省嘉兴市嘉善经济开发区晋亿大道8号,浙江省嘉兴市嘉善经济开发区晋亿大道8号,www.GEM-YEAR.com,2007-1-26
