省,市,区县,公司简称,公司全名,行业,2017前3季度销售额(万）,利润(万）,利润率,股票代码,注册地址,办公地址,官网,上市日期
江西省,南昌市,青山湖区,万年青,江西万年青水泥股份有限公司,建材与构件,461506,58535,12.70%,万年青(000789),,江西省万年县陈营镇,江西省南昌市高新技术开发区京东大道399号,www.wnq.com.cn,1997-9-23
江西省,南昌市,青山湖区,赣能股份,江西赣能股份有限公司,电力（IV）,158431,17897,11.30%,赣能股份(000899),,江西省南昌市高新技术开发区火炬大街199号,江西省南昌市高新技术开发区火炬大街199号,www.000899.com,1997-11-26
江西省,南昌市,青山湖区,诚志股份,诚志股份有限公司,通用化工品,420099,66840,15.90%,诚志股份(000990),,江西省南昌市经济开发区玉屏东大道299号,江西省南昌市经济开发区玉屏东大道299号清华科技园（江西）华江大厦,www.chengzhi.com.cn,2000-7-6
江西省,南昌市,青山湖区,正邦科技,江西正邦科技股份有限公司,农业与渔业,1472882,43927,3.00%,正邦科技(002157),,江西省南昌市高新技术开发区艾溪湖一路569号,江西省南昌市高新技术开发区艾溪湖一路569号,www.zhengbang.com,2007-8-17
江西省,南昌市,青山湖区,*ST昌九,江西昌九生物化工股份有限公司,特种化工品,39410,-1473,-3.70%,*ST昌九(600228),,江西省赣州市章贡区黄屋坪路25号,江西省南昌市青山湖区尤氨路,www.600228.net,1999-1-19
江西省,南昌市,青山湖区,联创光电,江西联创光电科技股份有限公司,电子电气组件与设备,216782,19117,8.80%,联创光电(600363),,江西省南昌市高新产业技术开发区京东大道168号,江西省南昌市高新产业技术开发区京东大道168号,www.lianchuang.com.cn,2001-3-29
江西省,南昌市,青山湖区,中文传媒,中文天地出版传媒股份有限公司,出版业,899084,115013,12.80%,中文传媒(600373),,江西省上饶市南环路2号,江西省南昌市红谷滩新区学府大道299号中文传媒大厦,www.600373.com.cn,2002-3-4
江西省,南昌市,青山湖区,方大特钢,方大特钢科技股份有限公司,钢铁,1012691,204932,20.20%,方大特钢(600507),,江西省南昌市高新技术产业开发区火炬大道31号,江西省南昌市青山湖区冶金大道475号,www.changli-steels.com,2003-9-30
江西省,南昌市,青山湖区,泰豪科技,泰豪科技股份有限公司,电子电气组件与设备,230225,12852,5.60%,泰豪科技(600590),,江西省南昌高新开发区清华泰豪大楼,江西省南昌高新开发区清华泰豪大厦,www.tellhow.com,2002-7-3
