省,市,区县,公司简称,公司全名,行业,2017前3季度销售额(万）,利润(万）,利润率,股票代码,注册地址,办公地址,官网,上市日期
上海市,闵行区,闵行区,思源电气,思源电气股份有限公司,电子电气组件与设备,283501,17839,6.30%,思源电气(002028),上海市闵行区金都路4399号,上海市闵行区华宁路3399号,www.sieyuan.com,2004-8-5
上海市,闵行区,闵行区,威尔泰,上海威尔泰工业自动化股份有限公司,工业机械,6820,-154,-2.30%,威尔泰(002058),上海市闵行区虹中路263号1幢,上海市闵行区虹中路263号,dm@welltech.com.cn,2006-8-2
上海市,闵行区,闵行区,悦心健康,上海悦心健康集团股份有限公司,耐用消费品,66011,2016,3.10%,悦心健康(002162),上海市闵行区浦江镇三鲁公路2121号,上海市闵行区浦江镇三鲁公路2121号,www.cimic.com,2007-8-23
上海市,闵行区,闵行区,海得控制,上海海得控制系统股份有限公司,工业机械,133620,469,0.40%,海得控制(002184),上海市闵行区漕河泾开发区浦江高科技园新骏环路777号,上海市闵行区漕河泾开发区浦江高科技园新骏环路777号,www.hite.com.cn,2007-11-16
上海市,闵行区,闵行区,神开股份,上海神开石油化工装备股份有限公司,工业机械,35285,-555,-1.60%,神开股份(002278),上海市闵行区浦星公路1769号,上海市闵行区浦星公路1769号,www.shenkai.com,2009-8-11
上海市,闵行区,闵行区,松芝股份,上海加冷松芝汽车空调股份有限公司,汽车零配件（IV）,266987,19398,7.30%,松芝股份(002454),上海市莘庄工业区华宁路4999号,上海市莘庄工业区华宁路4999号,www.shsongz.com.cn,2010-7-20
上海市,闵行区,闵行区,万达信息,万达信息股份有限公司,计算机服务,137321,8398,6.10%,万达信息(300168),上海市桂平路481号20号楼5层,上海市联航路1518号,www.wondersgroup.com,2011-1-25
上海市,闵行区,闵行区,东富龙,上海东富龙科技股份有限公司,工业机械,119528,14256,11.90%,东富龙(300171),上海市闵行区都会路1509号4幢,上海市闵行区都会路1509号,www.tofflon.com,2011-2-1
上海市,闵行区,闵行区,天玑科技,上海天玑科技股份有限公司,软件,26679,5029,18.90%,天玑科技(300245),上海市青浦区清河湾路1200号1008室,上海市闵行区田林路1016号科技绿洲三期6号楼,www.dnt.com.cn,2011-7-19
上海市,闵行区,闵行区,沃施股份,上海沃施园艺股份有限公司,建筑施工,23923,369,1.50%,沃施股份(300483),上海闵行区元江路5000号,上海闵行区元江路5000号,www.worthgarden.com,2015-6-30
上海市,闵行区,闵行区,海顺新材,上海海顺新型药用包装材料股份有限公司,制药,26872,5434,20.20%,海顺新材(300501),上海市松江区洞泾镇蔡家浜路18号,上海市闵行区申滨南路938号龙湖虹桥天街G栋508室,www.haishungroup.com,2016-2-4
上海市,闵行区,闵行区,维宏股份,上海维宏电子科技股份有限公司,软件,15186,7366,48.50%,维宏股份(300508),上海市闵行区联航路1588号1幢业务楼B509室,上海市闵行区联航路1588号1幢业务楼B509室,www.weihong.com.cn,2016-4-19
上海市,闵行区,闵行区,移为通信,上海移为通信技术股份有限公司,通讯设备,21197,6717,31.70%,移为通信(300590),上海市闵行区宜山路1618号E厂房801A室,上海市田州路99号新茂大楼501室,www.queclink.com,2017-1-11
上海市,闵行区,闵行区,光明乳业,光明乳业股份有限公司,食品生产（IV）,1650720,84243,5.10%,光明乳业(600597),上海市吴中路578号,上海市吴中路578号,www.brightdairy.com,2002-8-28
上海市,闵行区,闵行区,申能股份,申能股份有限公司,电力（IV）,2367125,213187,9.00%,申能股份(600642),上海市虹井路159号5楼,上海市虹井路159号5楼,www.shenergy.net.cn,1993-4-16
上海市,闵行区,闵行区,泛微网络,上海泛微网络科技股份有限公司,软件与计算机服务,44838,2012,4.50%,泛微网络(603039),上海市奉贤区环城西路3006号,上海市闵行区浦江镇联航路1188号浦江智谷33号楼泛微软件大厦,www.weaver.com.cn,2017-1-13
上海市,闵行区,闵行区,至纯科技,上海至纯洁净系统科技股份有限公司,工业品与服务,22550,3473,15.40%,至纯科技(603690),上海市闵行区紫海路170号,上海市闵行区紫海路170号,www.pnc-systems.com,2017-1-13
上海市,闵行区,闵行区,鸣志电器,上海鸣志电器股份有限公司,电子电气组件与设备,120696,13078,10.80%,鸣志电器(603728),上海市闵行区闵北工业区鸣嘉路168号,上海市闵行区闵北工业区鸣嘉路168号,www.moons.com.cn,2017-5-9
上海市,闵行区,闵行区,至正股份,上海至正道化高分子材料股份有限公司,电力（III）,24912,2246,9.00%,至正股份(603991),上海市莘庄工业区元江路5050号,上海市莘庄工业区元江路5050号,www.sh-original.com,2017-3-8
上海市,闵行区,闵行区,广汇汽车,广汇汽车服务股份公司,汽车,11213189,419614,3.70%,广汇汽车(600297),辽宁省大连市甘井子区营升路九号,上海市闵行区虹莘路3998号,http://www.chinagrandauto.com/cn/,2000-11-16
上海市,闵行区,闵行区,东方银星,河南东方银星投资股份有限公司,不动产投资开发,22294,928,4.20%,东方银星(600753),河南省商丘市民权县人民路东段南侧盛世名门三号楼1单元1002室,上海市闵行区闵虹路166号城开中心1号楼32层,www.bingxiong.com.cn,1996-9-27
上海市,闵行区,闵行区,哈工智能,江苏哈工智能机器人股份有限公司,通用化工品,96024,7906,8.20%,哈工智能(000584),江苏省江阴市临港街道双良路15号,上海市闵行区吴中路1799号D栋8楼808,www.hgzngroup.com.cn,1995-11-28
上海市,闵行区,闵行区,宝利国际,江苏宝利国际投资股份有限公司,特种化工品,116173,1048,0.90%,宝利国际(300135),江苏省江阴市云亭镇工业园区,上海市闵行区申长路988弄虹桥万科中心2号楼801-805,www.baolijt.cn,2010-10-26
上海市,闵行区,闵行区,森马服饰,浙江森马服饰股份有限公司,服装服饰零售,804225,139897,17.40%,森马服饰(002563),浙江省温州市瓯海区娄桥工业园南汇路98号,上海市闵行区莲花南路2689号,www.semirbiz.com,2011-3-11
上海市,闵行区,闵行区,恺英网络,恺英网络股份有限公司,互联网,209469,109202,52.10%,恺英网络(002517),福建省泉州市经济技术开发区清?髟扒?美泰路36号,上海市闵行区陈行路2388号浦江科技广场3号楼3楼,www.taiya.hk,2010-12-7
