省,市,区县,公司简称,公司全名,行业,2017前3季度销售额(万）,利润(万）,利润率,股票代码,注册地址,办公地址,官网,上市日期
四川省,成都市,武侯区,藏格控股,藏格控股股份有限公司,通用化工品,197714,78312,39.60%,藏格控股(000408),青海省格尔木市昆仑南路15-02号,成都市高新区天府大道中段279号成达大厦11楼1107室,--,1996-6-28
四川省,成都市,武侯区,西藏发展,西藏银河科技发展股份有限公司,酿酒业,26345,3963,15.00%,西藏发展(000752),西藏自治区拉萨市色拉路36号,成都市武侯区人民南路4段45号新希望大厦1608,--,1997-6-25
四川省,成都市,武侯区,华塑控股,同人华塑股份有限公司,建材与构件,151840,-540,-0.40%,华塑控股(000509),四川省南充市涪江路117号,四川省成都市武侯区火车南站西路15号麦田中心15F,--,1993-5-7
四川省,成都市,武侯区,兴蓉环境,成都市兴蓉环境股份有限公司,水务,272497,89105,32.70%,兴蓉环境(000598),四川省成都市青羊区苏坡乡万家湾村,四川省成都市武侯区锦城大道1000号4-5楼,www.cdxrec.com,1996-5-29
四川省,成都市,武侯区,高新发展,成都高新发展股份有限公司,建筑施工,41662,3283,7.90%,高新发展(000628),四川省成都市高新技术产业开发区,四川省成都高新区九兴大道8号,www.cdgxfz.com,1996-11-18
四川省,成都市,武侯区,四川双马,四川双马水泥股份有限公司,建材与构件,185981,12556,6.80%,四川双马(000935),四川省江油市二朗庙镇,成都市高新区盛和一路88号康普雷斯大厦一单元25楼,www.cement.com.cn,1999-8-24
四川省,成都市,武侯区,川大智胜,四川川大智胜软件股份有限公司,软件,15401,1818,11.80%,川大智胜(002253),四川省成都市武科东一路七号,四川省成都市武科东一路七号,www.wisesoft.com.cn,2008-6-23
四川省,成都市,武侯区,卫士通,成都卫士通信息产业股份有限公司,计算机服务,103343,-14062,-13.60%,卫士通(002268),四川省成都高新技术产业开发区云华路333号,四川省成都市高新技术产业开发区云华路333号二栋,www.westone.com.cn,2008-8-11
四川省,成都市,武侯区,成都路桥,成都市路桥工程股份有限公司,建筑施工,113920,3187,2.80%,成都路桥(002628),四川省成都市武侯区武科东四路11号,四川省成都市武侯区武科东四路11号,www.cdlq.com,2011-11-3
四川省,成都市,武侯区,利君股份,成都利君实业股份有限公司,工业机械,34537,8846,25.60%,利君股份(002651),四川省成都市武侯区武科东二路5号,四川省成都市武侯区武科东二路5号,www.cdleejun.com,2012-1-6
四川省,成都市,武侯区,硅宝科技,成都硅宝科技股份有限公司,特种化工品,49466,4016,8.10%,硅宝科技(300019),四川省成都高新区新园大道16号,四川省成都高新区新园大道16号,www.cnguibao.com,2009-10-30
四川省,成都市,武侯区,振芯科技,成都振芯科技股份有限公司,通讯设备,26884,4099,15.20%,振芯科技(300101),四川省成都高新区高朋大道1号,四川省成都高新区高朋大道1号,www.corpro.cn,2010-8-6
四川省,成都市,武侯区,银河磁体,成都银河磁体股份有限公司,电子电气组件与设备,37460,11208,29.90%,银河磁体(300127),四川省成都市高新技术开发区西区百草路6号,四川省成都市高新技术开发区西区百草路6号,www.galaxymagnets.com,2010-10-13
四川省,成都市,武侯区,依米康,四川依米康环境科技股份有限公司,工业机械,59575,1670,2.80%,依米康(300249),四川省成都高新区科园南二路二号,四川省成都高新区科园南二路二号,www.sunrisegroup.com.cn,2011-8-3
四川省,成都市,武侯区,中光防雷,四川中光防雷科技股份有限公司,通讯设备,25213,3397,13.50%,中光防雷(300414),四川省成都高新区西部园区天宇路19号,四川省成都高新区西部园区天宇路19号,www.zhongguang.com,2015-5-13
四川省,成都市,武侯区,环能科技,环能科技股份有限公司,工业机械,47614,6184,13.00%,环能科技(300425),四川省成都市武侯区兴一路3号,四川省成都市武侯区兴一路3号,www.scimee.com,2015-2-16
四川省,成都市,武侯区,运达科技,成都运达科技股份有限公司,计算机服务,39381,8055,20.50%,运达科技(300440),四川省成都高新区新达路11号,四川省成都高新区新达路11号,www.yd-tec.com,2015-4-23
四川省,成都市,武侯区,迅游科技,四川迅游网络科技股份有限公司,互联网,14067,5383,38.30%,迅游科技(300467),四川省成都高新区世纪城南路599号7栋6、7层,四川省成都高新区世纪城南路599号7栋6、7层,www.xunyou.com,2015-5-27
四川省,成都市,武侯区,日机密封,四川日机密封件股份有限公司,工业机械,35353,9394,26.60%,日机密封(300470),四川省成都市武侯区武科西四路八号,四川省成都市武侯区武科西四路八号,www.sns-china.com,2015-6-12
四川省,成都市,武侯区,厚普股份,成都华气厚普机电设备股份有限公司,工业机械,68856,5833,8.50%,厚普股份(300471),成都高新区世纪城南路599号6栋11层3号,成都市高新区康隆路555号,www.hqhop.com,2015-6-11
四川省,成都市,武侯区,新易盛,成都新易盛通信技术股份有限公司,电子电气组件与设备,66192,11062,16.70%,新易盛(300502),四川省成都高新区高朋大道21号1幢四楼,四川省成都高新区高朋大道21号1幢四楼,www.eoptolink.com,2016-3-3
四川省,成都市,武侯区,佳发安泰,成都佳发安泰科技股份有限公司,软件,10218,3776,37.00%,佳发安泰(300559),四川省成都市武侯区武兴五路433号（武侯新城管委会内）,四川省成都市武侯区武兴五路433号（武侯新城管委会内）,ww.jf-r.com,2016-11-1
四川省,成都市,武侯区,中科信息,中科院成都信息技术股份有限公司,软件,12518,665,5.30%,中科信息(300678),四川省成都市高新区天晖路360号晶科1号大厦18栋1803室,四川省成都市人民南路四段九号,www.casit.com.cn,2017-7-28
四川省,成都市,武侯区,川投能源,四川川投能源股份有限公司,电力（IV）,55270,289719,524.20%,川投能源(600674),四川省成都市临江西路1号,四川省成都市临江西路1号,www.scte.com.cn,1993-9-24
四川省,成都市,武侯区,S*ST前锋,成都前锋电子股份有限公司,不动产投资开发,2207,-182,-8.30%,S前锋(600733),四川省成都市武侯区人民南路四段1号,成都市高新区吉庆3路333号蜀都中心2期1栋3单元16层,www.600733.net,1996-8-16
四川省,成都市,武侯区,四川成渝,四川成渝高速公路股份有限公司,运输服务,578444,120844,20.90%,四川成渝(601107),四川省成都市武侯祠大街252号,四川省成都市武侯祠大街252号,www.cygs.com,2009-7-27
