省,市,区县,公司简称,公司全名,行业,2017前3季度销售额(万）,利润(万）,利润率,股票代码,注册地址,办公地址,官网,上市日期
河北省,石家庄市,裕华区,河钢股份,河北钢铁股份有限公司,钢铁,8690571,302114,3.50%,河钢股份(000709),河北省石家庄市体育南大街385号,河北省石家庄市体育南大街385号,www.hebgtgf.com,1997/4/16
河北省,石家庄市,裕华区,东方能源,石家庄东方能源股份有限公司,电力（IV）,176222,9429,5.40%,东方能源(000958),河北省石家庄市建华南大街161号,河北省石家庄市建华南大街161号,www.dfrdjt.com,1999/12/23
河北省,石家庄市,裕华区,以岭药业,石家庄以岭药业股份有限公司,制药,305970,53822,17.60%,以岭药业(002603),河北省石家庄市高新技术产业开发区天山大街238号,河北省石家庄市高新技术产业开发区天山大街238号,www.yiling.cn,2011/7/28
河北省,石家庄市,裕华区,冀凯股份,冀凯装备制造股份有限公司,工业机械,21569,933,4.30%,冀凯股份(002691),河北省石家庄高新区湘江道418号,河北省石家庄高新区湘江道418号,www.jikaigf.com,2012/7/31
河北省,石家庄市,裕华区,恒信东方,恒信东方文化股份有限公司,移动通信服务,28493,9862,34.60%,恒信东方(300081),河北省石家庄市开发区天山大街副69号,河北省石家庄市建设南大街80号恒辉商务大厦,www.hxgro.com,2010/5/20
河北省,石家庄市,裕华区,先河环保,河北先河环保科技股份有限公司,电子设备,62470,10150,16.20%,先河环保(300137),河北省石家庄市高新技术开发区湘江道251号,河北省石家庄市高新技术开发区湘江道251号,www.sailhero.com.cn,2010/11/5
河北省,石家庄市,裕华区,汇金股份,河北汇金机电股份有限公司,工业机械,29479,-5416,-18.40%,汇金股份(300368),河北省石家庄高新技术产业开发区湘江道209号,河北省石家庄高新技术产业开发区湘江道209号,www.hjjs.com,2014/1/23
河北省,石家庄市,裕华区,通合科技,石家庄通合电子科技股份有限公司,工业机械,11995,-790,-6.60%,通合科技(300491),河北省石家庄高新区漓江道350号,河北省石家庄高新区漓江道350号,www.sjzthdz.com,2015/12/31
