省,市,区县,公司简称,公司全名,行业,2017前3季度销售额(万）,利润(万）,利润率,股票代码,注册地址,办公地址,官网,上市日期
浙江省,台州市,玉环县,中捷资源,中捷资源投资股份有限公司,工业机械,68363,-6197,-9.10%,中捷资源(002021),浙江省玉环县大麦屿街道兴港东路198号,浙江省玉环县大麦屿街道兴港东路198号,www.zoje.com,2004-7-15
浙江省,台州市,玉环县,永和智控,永和流体智控股份有限公司,工业机械,40754,5154,12.60%,永和智控(002795),浙江省玉环县清港镇工业产业集聚区,浙江省玉环县清港镇工业产业集聚区,www.yhvalve.com,2016-4-28
浙江省,台州市,玉环县,正裕工业,浙江正裕工业股份有限公司,汽车与零配件（II）,62950,7028,11.20%,正裕工业(603089),浙江省玉环县珠港镇三合潭工业区双港路,浙江省玉环县珠港镇三合潭工业区双港路,www.addchina.com,2017-1-26
浙江省,台州市,仙居县,仙琚制药,浙江仙琚制药股份有限公司,制药,198879,18687,9.40%,仙琚制药(002332),浙江省仙居县仙药路1号,浙江省仙居县仙药路1号,www.xjpharma.com,2010-1-12
浙江省,台州市,仙居县,浙江仙通,浙江仙通橡塑股份有限公司,汽车与零配件（II）,49559,14242,28.70%,浙江仙通(603239),浙江省台州市仙居县现代工业集聚区,浙江省台州市仙居县现代工业集聚区,www.zjxiantong.com,2016-12-30
浙江省,台州市,仙居县,司太立,浙江司太立制药股份有限公司,制药,55161,8427,15.30%,司太立(603520),浙江省仙居县现代工业集聚区司太立大道1号,浙江省仙居县现代工业集聚区司太立大道1号,http://www.starrypharm.com,2016-3-9
浙江省,台州市,温岭市,钱江摩托,浙江钱江摩托股份有限公司,汽车,185975,5609,3.00%,钱江摩托(000913),浙江省温岭市经济开发区,浙江省温岭市经济开发区,www.qjmotor.com,1999-5-14
浙江省,台州市,温岭市,爱仕达,浙江爱仕达电器股份有限公司,耐用消费品,214684,12258,5.70%,爱仕达(002403),浙江省温岭市经济开发区科技路2号,浙江省温岭市经济开发区科技路2号,www.chinaasd.com,2010-5-11
浙江省,台州市,温岭市,新界泵业,浙江新界泵业股份有限公司,工业机械,108962,16980,15.60%,新界泵业(002532),浙江省温岭市大溪镇大洋城工业区,浙江省温岭市大溪镇大洋城工业区,www.shimge.com,2010-12-31
浙江省,台州市,温岭市,跃岭股份,浙江跃岭股份有限公司,汽车零配件（IV）,56258,2535,4.50%,跃岭股份(002725),浙江省温岭市泽国镇泽国大道888号,浙江省温岭市泽国镇现代大道北侧,www.yuering.com,2014-1-29
浙江省,台州市,温岭市,东音股份,浙江东音泵业股份有限公司,工业机械,62541,10767,17.20%,东音股份(002793),浙江省温岭市大溪镇大石一级公路南侧,浙江省温岭市大溪镇大石一级公路南侧,www.doyin.com,2016-4-15
浙江省,台州市,温岭市,大元泵业,浙江大元泵业股份有限公司,专业零售,77188,14184,18.40%,大元泵业(603757),浙江省温岭市泽国镇丹崖工业区,浙江省温岭市泽国镇丹崖工业区,www.cnpumps.com,2017-7-11
浙江省,台州市,温岭市,中马传动,浙江中马传动股份有限公司,汽车与零配件（II）,63922,6264,9.80%,中马传动(603767),浙江省温岭市石塘镇上马工业区经一路1号,浙江省温岭市石塘镇上马工业区经一路1号,www.zomaxcd.com,2017-6-13
浙江省,台州市,天台县,银轮股份,浙江银轮机械股份有限公司,汽车零配件（IV）,309062,31368,10.10%,银轮股份(002126),浙江省天台县福溪街道始丰东路8号,浙江省天台县福溪街道交通运输机械工业园区,www.yinlun.com,2007-4-18
浙江省,台州市,天台县,永贵电器,浙江永贵电器股份有限公司,电子电气组件与设备,84903,13638,16.10%,永贵电器(300351),浙江省天台县白鹤镇东园路5号（西工业区）,浙江省天台县白鹤镇东园路5号（西工业区）,www.yonggui.com,2012-9-20
浙江省,台州市,天台县,天铁股份,浙江天铁实业股份有限公司,通用化工品,20410,5710,28.00%,天铁股份(300587),浙江省天台县人民东路928号,浙江省天台县人民东路928号,www.tiantie.cn,2017-1-5
浙江省,台州市,天台县,圣达生物,浙江圣达生物药业股份有限公司,食品生产（III）,36961,5843,15.80%,圣达生物(603079),浙江省天台县赤城街道人民东路789号,浙江省天台县赤城街道人民东路789号,www.sd-pharm.com,2017-8-23
浙江省,台州市,天台县,天成自控,浙江天成自控股份有限公司,汽车零配件（IV）,50549,5648,11.20%,天成自控(603085),浙江省台州市天台县西工业区,浙江省台州市天台县西工业区,www.china-tc.com,2015-6-30
浙江省,台州市,三门县,三变科技,三变科技股份有限公司,电子电气组件与设备,37239,-5669,-15.20%,三变科技(002112),浙江省三门县海游镇西区大道369号,浙江省三门县海游镇西区大道369号,www.sanbian.cn,2007-2-8
浙江省,台州市,三门县,三维股份,浙江三维橡胶制品股份有限公司,通用化工品,66033,3820,5.80%,三维股份(603033),浙江省台州市三门县海游街道下坑村,浙江省台州市三门县海游街道下坑村,www.three-v.com,2016-12-7
浙江省,台州市,路桥区,亿利达,浙江亿利达风机股份有限公司,工业机械,96290,13845,14.40%,亿利达(002686),浙江省台州市路桥区横街镇亿利达路,浙江省台州市路桥区横街镇亿利达路,www.yilida.com,2012-7-3
浙江省,台州市,路桥区,腾达建设,腾达建设集团股份有限公司,建筑施工,230045,19216,8.40%,腾达建设(600512),浙江省台州市路桥区路桥大道东1号,浙江省台州市路桥区路桥大道东1号,www.tengdajs.com,2002-12-26
浙江省,台州市,临海市,伟星股份,浙江伟星实业发展股份有限公司,服装与服饰,185526,36728,19.80%,伟星股份(002003),浙江省临海市花园工业区,浙江省临海市花园工业区,www.weixing.cn,2004-6-25
浙江省,台州市,临海市,伟星新材,浙江伟星新型建材股份有限公司,建材与构件,257572,65078,25.30%,伟星新材(002372),浙江省临海经济开发区,浙江省临海经济开发区,www.china-pipes.com,2010-3-18
浙江省,台州市,临海市,浙江永强,浙江永强集团股份有限公司,家具,305039,20140,6.60%,浙江永强(002489),浙江省临海市前江南路1号,浙江省临海市前江南路1号,www.yotrio.com,2010-10-21
浙江省,台州市,临海市,华海药业,浙江华海药业股份有限公司,制药,351002,55681,15.90%,华海药业(600521),浙江省临海市汛桥,浙江省临海市汛桥,www.huahaipharm.com,2003-3-4
浙江省,台州市,临海市,万盛股份,浙江万盛股份有限公司,特种化工品,111267,11452,10.30%,万盛股份(603010),浙江省临海市城关两水开发区,浙江省临海市城关两水开发区,www.ws-chem.com,2014-10-10
浙江省,台州市,临海市,奥翔药业,浙江奥翔药业股份有限公司,医药与生物科技,13970,3591,25.70%,奥翔药业(603229),浙江省临海市化学原料药基地临海园区东海第四大道5号,浙江省临海市化学原料药基地临海园区东海第四大道5号,www.ausunpharm.com,2017-5-9
浙江省,台州市,临海市,永太科技,浙江永太科技股份有限公司,特种化工品,189104,31497,16.70%,永太科技(002326),浙江省化学原料药基地临海园区东海第五大道1号,浙江省化学原料药基地临海园区,www.yongtaitech.com,2009-12-22
浙江省,台州市,开发区,南洋科技,浙江南洋科技股份有限公司,电子电气组件与设备,104206,10515,10.10%,南洋科技(002389),浙江省台州市开发区开发大道388号,浙江省台州市开发区开发大道388号,www.nykj.cc,2010-4-13
浙江省,台州市,椒江区,海翔药业,浙江海翔药业股份有限公司,制药,172173,33928,19.70%,海翔药业(002099),浙江省台州市椒江区外沙支路100号,浙江省台州市椒江区外沙支路100号,www.hisoar.com,2006-12-26
浙江省,台州市,椒江区,水晶光电,浙江水晶光电科技股份有限公司,电子电气组件与设备,151741,32359,21.30%,水晶光电(002273),浙江省台州市椒江区星星电子产业区A5号,浙江省台州市椒江区三甲街道开发大道东段2198号,www.crystal-optech.com,2008-9-19
浙江省,台州市,椒江区,信质电机,信质电机股份有限公司,工业机械,171824,22443,13.10%,信质电机(002664),浙江省台州市椒江区前所信质路28号,浙江省台州市椒江区前所信质路28号,www.chinaxinzhi.com,2012-3-16
浙江省,台州市,椒江区,星星科技,浙江星星瑞金科技股份有限公司,电子电气组件与设备,421312,8059,1.90%,星星科技(300256),浙江省台州市椒江区洪家星星电子产业基地4号楼,浙江省台州市椒江区洪家星星电子产业基地4号楼,www.first-panel.com,2011-8-19
浙江省,台州市,椒江区,海正药业,浙江海正药业股份有限公司,制药,817631,30377,3.70%,海正药业(600267),浙江省台州市椒江区外沙路46号,浙江省台州市椒江区外沙路46号,www.hisunpharm.com,2000-7-25
浙江省,台州市,椒江区,百达精工,浙江百达精工股份有限公司,汽车零配件（IV）,52069,5867,11.30%,百达精工(603331),浙江省台州市经中路908弄28号,浙江省台州市经中路908弄28号,www.baidapm.com,2017-7-5
浙江省,台州市,椒江区,杰克股份,杰克缝纫机股份有限公司,工业机械,211539,27871,13.20%,杰克股份(603337),浙江省台州市椒江区机场南路15号,浙江省台州市椒江区机场南路15号,www.chinajack.com,2017-1-19
浙江省,台州市,椒江区,九洲药业,浙江九洲药业股份有限公司,制药,123429,13612,11.00%,九洲药业(603456),浙江省台州市椒江区外沙工业区,浙江省台州市椒江区外沙工业区,www.jiuzhoupharma.com,2014-10-10
浙江省,台州市,椒江区,中新科技,中新科技集团股份有限公司,计算机硬件,412378,8816,2.10%,中新科技(603996),浙江省台州市椒江区工人西路618-2号,浙江省台州市椒江区工人西路618-2号,www.cncoptronics.cn,2015-12-22
浙江省,台州市,黄岩区,联化科技,联化科技股份有限公司,特种化工品,290609,23297,8.00%,联化科技(002250),浙江省台州市黄岩区江口经济开发区永椒路8号,浙江省台州市黄岩区劳动北路总商会大厦17楼,www.lianhetech.com,2008-6-19
浙江省,台州市,黄岩区,永高股份,永高股份有限公司,通用化工品,321646,13574,4.20%,永高股份(002641),浙江省台州市黄岩经济开发区埭西路2号,浙江省台州市黄岩区黄椒路555号永高双浦新厂区,www.yonggao.com；www.era.com.cn,2011-12-8
浙江省,台州市,黄岩区,天宇股份,浙江天宇药业股份有限公司,制药,88297,12330,14.00%,天宇股份(300702),浙江省台州市黄岩江口化工开发区,浙江省台州市黄岩江口化工开发区,www.tianyupharm.com,2017-9-19
浙江省,台州市,黄岩区,东方材料,新东方新材料股份有限公司,通用化工品,31241,5204,16.70%,东方材料(603110),浙江省台州市黄岩区东城街道劳动北路118（8层）号,台州市黄岩区东城街道劳动北路118号8楼,--,2017-10-13
浙江省,台州市,黄岩区,济民制药,浙江济民制药股份有限公司,医疗设备,45054,5458,12.10%,济民制药(603222),浙江省台州市黄岩区北院路888号,浙江省台州市黄岩区北院路888号,www.chimin.cn,2015-2-17
